Artist,Related Artists
Tatsuya Kitani,"TOOBOE, 須田景凪, 水槽, tephe, DURDN, whaledontsleep, KANKAN, jon-YAKITORY, Kei Sugawara, Dios, haruno, Kiro Akiyama, Ayase, DUSTCELL, Yoh kamiyama, MAISONdes, PEOPLE 1, Hitorie, 和ぬか, NEE"
OFFICIAL HIGE DANDISM,"King Gnu, DISH//, Sukima Switch, SEKAI NO OWARI, back number, sumika, GReeeeN, Saucy Dog, SPITZ, YUZU, Creepy Nuts, FUNKY MONKEY BABYS, wacci, Awesome City Club, Motohiro Hata, Mrs. GREEN APPLE, iri, [Alexandros], AAA, Gen Hoshino"
Mrs. GREEN APPLE,"sumika, go!go!vanillas, [Alexandros], 04 Limited Sazabys, My Hair is Bad, King Gnu, Saucy Dog, SUPER BEAVER, WANIMA, BLUE ENCOUNT, SHISHAMO, KANA-BOON, Yabai T-Shirts Yasan, back number, SEKAI NO OWARI, Novelbright, GReeeeN, Creep Hyp, wacci, SPITZ"
Fujii Kaze,"DURDN, imase, iri, natori, indigo la End, Gen Hoshino, tonun, SIRUP, WurtS, Penthouse, King Gnu, yama, PEOPLE 1, Vaundy, Tele, Sheena Ringo, Creep Hyp, Tatsuya Kitani, aiko, haruno"
MAN WITH A MISSION,"the HIATUS, 10-FEET, ELLEGARDEN, 9mm Parabellum Bullet, Fear, and Loathing in Las Vegas, Pay money To my Pain, amazarashi, Straightener, ACIDMAN, BEAT CRUSADERS, THE ORAL CIGARETTES, SiM, [Alexandros], MONOEYES, WANIMA, Ken Yokoyama, DOES, ASIAN KUNG-FU GENERATION, Hello Sleepwalkers, Survive Said The Prophet"
MY FIRST STORY,"Survive Said The Prophet, Hello Sleepwalkers, The Winking Owl, THE ORAL CIGARETTES, ""ROOKiEZ is PUNKD"", BACK-ON, [Alexandros], Pay money To my Pain, Fear, and Loathing in Las Vegas, ROTTENGRAFFTY, SiM, a crowd of rebellion, Ling tosite sigure, BLUE ENCOUNT, MAN WITH A MISSION, flumpool, SPYAIR, coldrain, UVERworld, 04 Limited Sazabys"
natori,"Kaneee, DURDN, tonun, れん, Ayase, 和ぬか, Furui Riho, TOMOO, Tele, 池田智子 × TENDRE, MAISONdes, Penthouse, Tatsuya Kitani, iri, whaledontsleep, 須田景凪, imase, LANA, PEOPLE 1, R+..."
Yuuri,"Tani Yuuki, Novelbright, Lilas Ikuta, Takaya Kawasaki, SOUTH BLUE, wacci, HIRAIDAI, YOAKE, TakaseToya, DISH//, Macaroni Empitsu, SUDA MASAKI, Saucy Dog, れん, Mrs. GREEN APPLE, WANIMA, back number, Uru, Shota Shimizu, 鈴木鈴木"
imase,"DURDN, natori, tonun, Tele, YOAKE, WurtS, Rin音, れん, Penthouse, yangskinny, neguse., sloppy dim, 和ぬか, Furui Riho, haruno, iri, PEOPLE 1, Matsuri, 悠馬, Ayase"
Conton Candy,"35.7, Kaneyorimasaru, レトロマイガール!!, サバシスター, トンボコープ, bokula., ペルシカリア, bungeitengoku, Teikokukissa, パーカーズ, Qujila Yoluno Machi, プッシュプルポット, シャイトープ, ""chefs"", This is LAST, osage, ルサンチマン, UNFAIR RULE, YUTORI-SEDAI, なきごと"
Tani Yuuki,"SOUTH BLUE, れん, 音田 雅則, Novelbright, Takaya Kawasaki, 鈴木鈴木, YOAKE, SG, wacci, BAK, TENSONG, Yamazaru, 心之助, マルシィ, TakaseToya, Kyanai, HIRAIDAI, 上野大樹, 手がクリームパン, Lilas Ikuta"
Saucy Dog,"reGretGirl, sumika, go!go!vanillas, My Hair is Bad, 04 Limited Sazabys, SHISHAMO, Creep Hyp, wacci, HIRAIDAI, yonige, yangskinny, neguse., the shes gone, マルシィ, Mrs. GREEN APPLE, Mr.ふぉるて, Tele, SUPER BEAVER, moon drop, YOAKE"
ヨルシカ,"ZUTOMAYO, Ryokuoushoku Shakai, Lilas Ikuta, yama, YOAKE, MAISONdes, milet, Matsuri, Novelbright, n-buna, TakaseToya, 麦吉_Maggie, れん, にしな, あたらよ, whaledontsleep, PEOPLE 1, DISH//, Tani Yuuki, Macaroni Empitsu"
QUEEN BEE,"TK from Ling tosite sigure, Genie High, amazarashi, BLUE ENCOUNT, Cö shu Nie, frederic, UNISON SQUARE GARDEN, POLKADOT STINGRAY, Kiro Akiyama, 須田景凪, Hitorie, iri, PEOPLE 1, マキシマム ザ ホルモン 一部のアニメテーマ専用仮設チャンネル, TOOBOE, [Alexandros], Tatsuya Kitani, THE ORAL CIGARETTES, NEE, 龍宮城"
Kenshi Yonezu,"ARASHI, sakanaction, Gen Hoshino, UNISON SQUARE GARDEN, The Sharehappi from J Soul Brothers III from EXILE TRIBE, AAA, Sukima Switch, King Gnu, Aimer, Motohiro Hata, Creepy Nuts, Sheena Ringo, OFFICIAL HIGE DANDISM, [Alexandros], DECO*27, SPITZ, SEKAI NO OWARI, QUEEN BEE, syudou, GReeeeN"
back number,"Noriyuki Makihara, SPITZ, Ken Hirai, Creep Hyp, Remioromen, amazarashi, KEYTALK, SUPER BEAVER, FoZZtone, Winnie, RADWIMPS, Love Love Love, UNCHAIN, ハヌマーン, plenty, SISTERJET, androp, Sukima Switch, THE NOVEMBERS, the HIATUS"
Aimyon,"SUDA MASAKI, wacci, DISH//, neguse., Saucy Dog, Macaroni Empitsu, Novelbright, yangskinny, My Hair is Bad, aiko, Uru, Lilas Ikuta, WANIMA, SEKAI NO OWARI, YOAKE, SHISHAMO, HIRAIDAI, ayaka, GReeeeN, back number"
Macaroni Empitsu,"Yabai T-Shirts Yasan, My Hair is Bad, go!go!vanillas, Cidergirl, yangskinny, neguse., Saucy Dog, Creep Hyp, WurtS, HIRAIDAI, Tele, reGretGirl, Berry Goodman, the shes gone, YOAKE, Mr.ふぉるて, マルシィ, wacci, Humbreaders, SHISHAMO"
Ado,"jon-YAKITORY, Kanaria, MAISONdes, ZUTOMAYO, yama, Ryokuoushoku Shakai, DECO*27, syudou, TUYU, すりぃ, King Gnu, Creepy Nuts, Tatsuya Kitani, Novelbright, Kenshi Yonezu, milet, P丸様｡, PinocchioP, Kairikibear, ヨルシカ"
10-FEET,"B-DASH, Ken Yokoyama, dustbox, locofrank, LOW IQ 01, BEAT CRUSADERS, the HIATUS, Hawaiian6, WANIMA, Hi-STANDARD, Husking Bee, TOTALFAT, ELLEGARDEN, Snail Ramp, ACIDMAN, Straightener, SHAKALABBITS, Northern19, Over Arm Throw, DOPING PANDA"
MUKADE,"inman, Shinnosuke, LIL JAP, NAMEDARUMAAZ, Tsubaki, SHO-SENSEI!!, Linobu, bene baby, XY GENE, Merry Delo, Kvi Baba, Gokou Kuyt, YRD Leo, YOSHIKI EZAKI, O.A.KLAY, MIYACHI, yuno, Only U, JP THE WAVY, LEX"
Novelbright,"wacci, 鈴木鈴木, Takaya Kawasaki, Naoto Inti Raymi, BAK, DISH//, れん, TENSONG, Yamazaru, Tani Yuuki, Kyanai, Berry Goodman, SOUTH BLUE, Da-iCE, SG, 音田 雅則, Lilas Ikuta, Hazzie, YOAKE, ""CheNelle"""
indigo la End,"DADARAY, POLKADOT STINGRAY, Genie High, frederic, Kinokoteikoku, yonige, Suchmos, sakanaction, SHISHAMO, Tokyo Incidents, go!go!vanillas, My Hair is Bad, 04 Limited Sazabys, Creep Hyp, reGretGirl, Kami-sama, I have noticed, haruno, Regal Lily, Awesome City Club, Gesu No Kiwami Otome"
Irina Kairatovna,"Hiro, Shiza, Кисло-Сладкий & Bonah, Darkhan Juzz, Жугунусов Мирас, V $ X V PRiNCE, Bonapart, Yelah, Yenlik, dudeontheguitar, Ulukmanapo, Ninety One, Asik, Bakr, akha, Qanay, Sadraddin, CAPTOWN, tumen, ""MDee"""
Hiro,"Akira Senju, SawanoHiroyuki[nZk], Yugo Kanno, Yasuharu Takanashi, Mika Kobayashi, Masaru Yokoyama, Kenji Kawai, Kaoru Wada, Kevin Penkin, Kensuke Ushio, EGOIST, TK from Ling tosite sigure, Aimer, Yuki Hayashi, MYTH & ROID, Kalafina, Linked Horizon, Shiro SAGISU, Konomi Suzuki, Hideki Taniuchi"
V $ X V PRiNCE,"Truwer, Yanix, T-Fest, Skryptonite, JILLZAY, kizaru, Big Baby Tape, ""MDee"", Markul, Pika, Thomas Mraz, Mnogoznaal, Jah Khalib, Hiro, Darkhan Juzz, Irina Kairatovna, Bakr, Кисло-Сладкий & Bonah, Shiza, Ninety One"
Ulukmanapo,"Пабло, Shiza, Mr Lambo, Hiro, Bakr, РУВИ, JAMIK, Лёша Стелит, TEKSIDR, akha, Bonapart, Кисло-Сладкий & Bonah, CAPTOWN, Irina Kairatovna, LUCAVEROS, Брутто, Xassa, Sadraddin, Andy Panda, By Индия"
Bonapart,"abdr., Yenlik, akha, melonemes, Shiza, Duman, dudeontheguitar, Darkhan Juzz, jeltoksan., AlZaBi, Aikyn Tolepbergen, Ayau, Qanay, Hiro, Colorit, Taspay, Aidyn Zhumakhan, Kazybek Kuraiysh, The Adresov, Жугунусов Мирас, "
Bakr,"8lueredd, Anzar, TBT Prod., Lord Nekros, PHONK NOW, Kill AZYN, Musicality, Gabriele Motta, D.Meletis, SonHisako, prod.Sword, ""Dudes Cover"", PHONKYMONKY, Anime Lifestyle, Shiro SAGISU, Albanos Xwris Xartia, LezBeEpic Reuploads, Alisa Okehazama, DXXTHWXSH, Eternal Raijin"
Odetari,"Marluxiam, jnhygs, Lumi Athena, 6arelyhuman, Axxad, 9lives, Luci4, h!tex, Nuvfr, cade clair, kets4eki, xxanteria, Kanii, VaporGod, Lil Yawh, ODECORE, PR1SVX, Olivia Winters, siouxxie sixxsta, A$trakhan"
Darkhan Juzz,"dudeontheguitar, Yenlik, ARO, jeltoksan., Moldanazar, Shiza, melonemes, Ayau, Bonapart, Kazybek Kuraiysh, ZAQ, Hiro, Жугунусов Мирас, Ninety One, Aikyn Tolepbergen, Orynkhan, Qanay, kilemger, abdr., Кисло-Сладкий & Bonah"
Жугунусов Мирас,"Qanay, Kazybek Kuraiysh, Kalifarniya, Aikyn Tolepbergen, Duman, Sadraddin, 2Rar, Ayree, Nurzhan Kermenbayev, Argonya, AlZaBi, Yenlik, Aidyn Zhumakhan, Qarakesek, Кайрат Нуртас, Shokan Ualikhan, Darkhan Juzz, melonemes, Gazizkhan Shekerbekov, Bonapart"
MiyaGi & Endspiel,"Jah Khalib, T-killah, Kamazz, Zomb, Eldzhey, Kravz, МОТ, Kaspiyskiy Gruz, Basta, Scroodgee, Lesha Svik, TARAS, MATRANG, Luxor, ""LOne"", Max Korzh, Chestnyi, Geegun, Gio Pika, T-Fest"
Xcho,"SHAMI, Пабло, SUNAMI, Mr Lambo, РУВИ, Ulukmanapo, By Индия, Andro, ELMAN, Bakr, ""Ramil"", MACAN, JANAGA, Kambulat, coldcore, LUCAVEROS, Jakone, Gafur, ""VITALI"", JAMIK"
Jah Khalib,"МОТ, Zomb, MiyaGi & Endspiel, T-killah, Luxor, ""LOne"", Geegun, Eldzhey, Timati, Kamazz, MATRANG, Basta, Lesha Svik, Egor Kreed, HammAli & Navai, LUCAVEROS, Kaspiyskiy Gruz, TARAS, ELMAN, T1ONE"
NBSPLV,"KVPV, VaporGod, Baltra, Clovis Reyes, lucidbeatz, Marluxiam, ODECORE, xxanteria, 9lives, jnhygs, PR1SVX, Nuvfr, Isak Roen, Axxad, VDYCD, Pastel Ghost, Rompasso, glichery, h!tex, cade clair"
Asik,"We Came As Romans, blessthefall, Miss May I, The Word Alive, Of Mice & Men, I See Stars, The Devil Wears Prada, Memphis May Fire, Alesana, A Skylit Drive, Escape the Fate, Woe, Is Me, A Day To Remember, Abandon All Ships, Our Last Night, Motionless In White, Ice Nine Kills, Sleeping With Sirens, Falling In Reverse, Black Veil Brides"
Kordhell,"KUTE, SHADXWBXRN, MUPP, MC ORSEN, Dxrk ダーク, MoonDeity, SCXR SOUL, Ghostface Playa, Xantesha, Hensonn, ONIMXRU, KSLV Noh, SHPACKYOU$, Pluxry SkUrt, DVRST, ZODIVK, Sadfriendd, STXRZ, PRXSXNT FXTURE, PlayaPhonk"
The Neighbourhood,"Chase Atlantic, Beach Weather, Cults, TV Girl, Ari Abdul, Isabel LaRosa, Eyedress, girl in red, Montell Fish, awfultune, Mother Mother, Strawberry Guy, Current Joys, salvia palth, Mitski, Cavetown, Clairo, Jesse®, Wallows, Sir Chloe"
"Tyler, The Creator","Earl Sweatshirt, Domo Genesis, Frank Ocean, Vince Staples, Childish Gambino, MellowHype, Odd Future, A$AP Rocky, Jet Age of Tomorrow, Pusha T, Danny Brown, JPEGMAFIA, BROCKHAMPTON, Madvillain, Isaiah Rashad, Freddie Gibbs, Joey Bada$$, Death Grips, Denzel Curry, MF DOOM"
Saixse,"lucidrari, Offgrid, Against Mel, Rudeen, 53 UNIVERSE, Dannqrack, Gard, GARD WUZGUT, Dinho, LAWS, ChronicalZ, Eemrun, Nakalness, Fariz Jabba, Quai, Guccimith, YAPH, Nobi, MeerFly, ALYPH"
JVKE,"Lyn Lapid, Devin Kennedy, Suriel Hess, vaultboy, dhruv, elijah woods, demxntia, Chris James, Claire Rosinkranz, John Michael Howell, Rocco, Stephen Dawes, Ruel, Luke Chiang, sammy rash, grentperez, Takayoshi, MAX, brb., Stephen Sanchez"
Luqman Podolski,"GARD WUZGUT, Fariz Jabba, ForceParkBois, ALYPH, Yonnyboii, ChronicalZ, Slurpee Crank, YAPH, Quai, Against Mel, Amir Jahari, Nakalness, Offgrid, MeerFly, Ical Mosh, Zizan Razak, Bunkface, Joe Flizzow, lucidrari, K-Clique"
Doechii,"Jean Deaux, Kari Faux, Bree Runway, Cookiee Kawaii, iyla, Amindi, Monaleo, KenTheMan, Leikeli47, Baby Tate, Big Boss Vette, Rico Nasty, BIA, Chinese Kitty, Tierra Whack, Lola Brooke, Flo Milli, Ravyn Lenae, Junglepussy, Chlöe"
Sabrina Carpenter,"Julia Michaels, Fifth Harmony, Hailee Steinfeld, Bea Miller, The Girl and The Dreamcatcher, Dove Cameron, Charlotte Lawrence, Maggie Lindemann, Victorious Cast, Zendaya, Demi Lovato, Olivia Holt, Camila Cabello, Bridgit Mendler, Alessia Cara, Ellise, Sofia Carson, THE DRIVER ERA, PRETTYMUCH, Hey Violet"
Dalia Farhana,"Irfan Haris, Aziz Harun, Aiman Sidek, Fieya Julia, Najwa Latif, Afiq Adnan, Shahir, Insomniacks, IamNeeta, Reedzwann, Amir Jahari, Naim Daniel, Daniesh Suffian, Aizat Amdan, Sufian Suhaimi, Slurpee Crank, Firdaus Rahmat, Ernie Zakri, Aina Abdul, Damia"
Sufian Suhaimi,"Haqiem Rusli, Ismail Izzani, Aiman Tino, Nabila Razali, Hyper Act, Khai Bahar, IamNeeta, Dadilia Band, Zizan Razak, Floor 88, Tajul, Wany Hasrita, Irfan Haris, Ara Johari, Ayda Jebat, Ippo Hafiz, Asfan Shah, Hez Hazmi, Ariff Bahran, Naim Daniel"
dhruv,"Luke Chiang, demxntia, slchld, Hojean, Sway Bleu, The Millennial Club, Milky Day, ASTN, Christian Kuria, brb., RINI, Jeff Bernat, Takayoshi, Rangga Jones, Rainlord., Johnny Stimson, Jimmy Brown, Fiji Blue, Jesse Barrera, Devin Kennedy"
Ruth B.,"Alex & Sierra, Julia Michaels, Ashe, gnash, AJ Mitchell, Anna Clendening, Alec Benjamin, Alessia Cara, Tate McRae, Sara Kays, Anson Seabra, Sadie Jean, Zach Hood, Clinton Kane, Katherine Li, Ashley Kutcher, Frawley, Zevia, Jillian Rossi, Haley Joelle"
Peso Pluma,"Oscar Maydon, Chino Pacas, Grupo Los de la O, Los Gemelos De Sinaloa, Luis R Conriquez, Edgardo Nuñez, Aldo Trujillo, Tito Double P, Grupo Marca Registrada, Gabito Ballesteros, Natanael Cano, Edicion Especial, Lenin Ramírez, Grupo Arriesgado, Tito Torbellino Jr, Herencia de Patrones, T3R Elemento, Marca MP, Polo Gonzalez, LEGADO 7"
Junior H,"Natanael Cano, Oscar Maydon, Aldo Trujillo, T3R Elemento, Grupo Los de la O, Herencia de Patrones, Edgardo Nuñez, Los Gemelos De Sinaloa, LEGADO 7, Gabito Ballesteros, Chino Pacas, Polo Gonzalez, Edicion Especial, Nivel Codiciado, Marca MP, Grupo Marca Registrada, Tito Torbellino Jr, Luis R Conriquez, Lenin Ramírez, Calle 24"
Natanael Cano,"Oscar Maydon, Herencia de Patrones, Gabito Ballesteros, T3R Elemento, LEGADO 7, Polo Gonzalez, Grupo Los de la O, Aldo Trujillo, Calle 24, Chino Pacas, Ovi, Los Gemelos De Sinaloa, Dan Sanchez, Edgardo Nuñez, El de La Guitarra, Tito Torbellino Jr, Edicion Especial, Esteban Gabriel, Adriel Favela, Codiciado"
Carin Leon,"Grupo Firme, Lenin Ramírez, El Fantasma, Virlan Garcia, Perdidos De Sinaloa, Los Parras, Jovanny Cadena Y Su Estilo Privado, Gerardo Coronel, Cornelio Vega y su Dinastia, Alta Consigna, La Zenda Norteña, Cuarto de Milla, Crecer German, Joss Favela, Edicion Especial, Grupo Marca Registrada, Grupo Codiciado, Jorge Medina, Grupo Recluta, Los Austeros De Durango"
Oscar Maydon,"El Chachito, Gabito Ballesteros, Polo Gonzalez, Calle 24, Juanpa Salazar, Grupo Clasificado, La Receta, Tito Torbellino Jr, Tony Aguirre, Legion RG, Ysrael Barajas, JR Torres, LEGADO 7, Hans el Oso, Sebastian Esquivel, Pantera De Culiacan Sinaloa, Dan Sanchez, Edgardo Nuñez, Aldo Trujillo, Grupo Mente Maestra"
Chino Pacas,"Calle 24, Juanpa Salazar, Polo Gonzalez, Gabito Ballesteros, El Chachito, Sebastian Esquivel, Grupo Diez 4tro, LDNE, Tito Torbellino Jr, Victor Cibrian, Esteban Gabriel, Los Gemelos De Sinaloa, Dan Sanchez, LEGADO 7, Ysrael Barajas, Oscar Maydon, Herencia de Patrones, Grupo Triple L, Edgardo Nuñez, Tony Aguirre"
Eden Muñoz,"Los 2 de la S, Nathan Galante, Gerardo Coronel, Grupo Recluta, José Esparza, Nueva Marca, Código FN, Aldo Trujillo, Lenin Ramírez, Adriel Favela, Codiciado, Tito Torbellino Jr, Luis Alfonso Partida El Yaki, Javier Rosas Y Su Artillería Pesada, Hijos De Barron, Ulices Chaidez, Jovanny Cadena Y Su Estilo Privado, Virlan Garcia, La Poderosa Banda San Juan, Abraham Vazquez"
Cartel De Santa,"Control Machete, Akwid, Kinto Sol, Dharius, Sabino, Grupo Marrano, Millonario & W. Corona, Inspector, Panteon Rococo, Aleman, Valentín Elizalde, Genitallica, Los Titanes De Durango, La Banda Baston, Charles Ans, El Gran Silencio, Celso Piña, Simpson Ahuevo, Millonario, El Komander"
Tito Double P,"La Receta, 5 Music MX, Anthonyo Montana, Panter Bélico, Gabito Ballesteros, Herencia De Grandes, Grupo Clasificado, Enigma Norteño, Tony Aguirre, Grupo 360, Panchito Arredondo, Edicion Especial, Legion RG, Royrf, La Ventaja, El Chachito, LEGADO 7, Código FN, Diego Coss, Grupo Mente Maestra"
Michelle Maciel,"Ramon Vega, Francely Abreuu, Valeria Canavati, Sofia Castro, Nina, Ingratax, Mont, Pau Laggies, Leon Leiden, Like, Romi Marcos, Pitizion, Andry Kiddos, El Frizian, José Esparza, DAAZ, Dany Calvario, Chucho Rivas, RENEE, Don Zares, "
El Chachito,"Ivan Orozco, Ysrael Barajas, Alex Favela, David Ornelas, Grupo Mente Maestra, Grupo Selectivo, Juanpa Salazar, Legion RG, Hans el Oso, 5 Music MX, Sebastian Esquivel, Victor Rivera Y Su Nuevo Estilo, Pantera De Culiacan Sinaloa, Ruben Figueroa, Jaziel Avilez, Angel Cervantes, Bajo Perfil, Plan de Escape, Chuy Montana, miguel cornejo"
Belanova,"Jotdog, Playa Limbo, Mœnia, Paty Cantú, Nikki Clan, Fey, OV7, Kabah, LU, Lynda, Moderatto, Sentidos Opuestos, JEANS, Onda Vaselina, Aleks Syntek, Sandoval, Kudai, Julieta Venegas, La Quinta Estacion, Paulina Rubio"
LATIN MAFIA,"Nsqk, AQUIHAYAQUIHAY, Jesse Baez, legallyrxx, Lvtin Mvfia, Absa G., Humbe, Méne, YOSHI, Alvaro Diaz, Carlos Corté$, Milo Mae, The Change, OPYI, Sen Senra, Marcos Menchaca, suei, rusowsky, Zizzy, Papi Sousa"
Lartiste,"Lacrim, ""LAlgérino"", Dadju, KeBlack, Mister You, Still Fresh, Hayce Lemsi, Franglish, La Fouine, Vegedream, MHD, Sadek, YL, Alonzo, Lyna Mahyem, Gradur, Scridge, Abou Debeing, ""RimK"", Sofiane"
Ayoub Anbaoui,"Lemhllwess, Hassa1, Mr. Crazy, Demon324, Tflow, 7-Toun, Lbenj, Lferda, LFERDA, Raste, Rubio, Winners 2005, Abdeelgha4, Ultras Eagles 06, Achraf Maghrabi, Gnawi, Flack, Moro, La Voce Della Magana, Profit Za3im"
Houssainy,"Mocci, Mounim Slimani, Duke, Aezaddy, RYM, Mido Belahbib, Abdeelgha4, Cravata, Nouamane Belaiachi, Salma Rachid, Raste, Hind Ziadi, Ayoub Anbaoui, Ayoub Africano, kouz1, Weld Aicha, Achraf Maghrabi, Mehdi Mozayine, Hatim Ammor, Mehdi Fadili"
Niro,"Still Fresh, Sadek, Lacrim, Guizmo, Mister You, ""RimK"", GLK, Dosseh, Mac Tyer, Sofiane, YL, Kaaris, Hayce Lemsi, Gradur, Rimkus, DA Uzi, Timal, Alonzo, S.Pri Noir, Kalash Criminel"
Moha K,"Noodels, Emkal, DJ Kayz, Jayel, Nassi, Oualid, SisiK, Scridge, Oussama, Souf, Leila AD, GS, Alrima, Lyna Mahyem, Tiiwtiiw, DJ Hamida, Lynda, Anas, Marwa Loud, SAF"
kouz1,"Raste, Tagne, Mons, Stormy, Anys, 7ari, OUENZA, Draganov, Snor, Inkonnu, Smallx, Mocci, Madd, Don Bigg, RYM, Abdeelgha4, Lbenj, Vargas, Dollypran, 7liwa"
Mocci,"Abdeelgha4, RYM, Mido Belahbib, Cravata, Raste, Mounim Slimani, Mehdi Mozayine, MA3IZ, Tagne, Hatim Ammor, Lbenj, Zouhair Bahaoui, Snor, Mons, 7-Toun, Don Bigg, Ta Ha, Salma Rachid, kouz1, OUENZA, ""Error occurred while searching for the artist Benzz. Status code: 429"", ""Error occurred while searching for the artist Snor. Status code: 429"", ""Error occurred while searching for the artist Oualid. Status code: 429"", ""Error occurred while searching for the artist Cheba Warda. Status code: 429"", ""Error occurred while searching for the artist Mons. Status code: 429"", ""Error occurred while searching for the artist TIF. Status code: 429"", ""Error occurred while searching for the artist Zouhair Bahaoui. Status code: 429"", ""Error occurred while searching for the artist OUENZA. Status code: 429"", ""Error occurred while searching for the artist Mehdi Fadili. Status code: 429"", ""Error occurred while searching for the artist Draganov. Status code: 429"", ""Error occurred while searching for the artist Aezaddy. Status code: 429"", ""Error occurred while searching for the artist Shobee. Status code: 429"", ""Error occurred while searching for the artist Dizzy DROS. Status code: 429"", ""Error occurred while searching for the artist ElGrandeToto. Status code: 429"", ""Error occurred while searching for the artist Mounim Slimani. Status code: 429"", ""Error occurred while searching for the artist Tagne. Status code: 429"", ""Error occurred while searching for the artist Don Bigg. Status code: 429"", ""Error occurred while searching for the artist Baby Gang. Status code: 429"", ""Error occurred while searching for the artist Raste. Status code: 429"", ""Error occurred while searching for the artist Davido. Status code: 429"", ""Error occurred while searching for the artist Manal. Status code: 429"", ""Error occurred while searching for the artist Duke. Status code: 429"", ""Error occurred while searching for the artist Asake. Status code: 429"", ""Error occurred while searching for the artist Omah Lay. Status code: 429"", ""Error occurred while searching for the artist Shallipopi. Status code: 429"", ""Error occurred while searching for the artist ODUMODUBLVCK. Status code: 429"", ""Error occurred while searching for the artist Bnxn. Status code: 429"", ""Error occurred while searching for the artist Seyi Vibez. Status code: 429"", ""Error occurred while searching for the artist Adekunle Gold. Status code: 429"", ""Error occurred while searching for the artist KCee. Status code: 429"", ""Error occurred while searching for the artist Olamide. Status code: 429"", ""Error occurred while searching for the artist Young Jonn. Status code: 429"", ""Error occurred while searching for the artist Blaqbonez. Status code: 429"", ""Error occurred while searching for the artist King Promise. Status code: 429"", ""Error occurred while searching for the artist Ruger. Status code: 429"", ""Error occurred while searching for the artist Zinoleesky. Status code: 429"", ""Error occurred while searching for the artist Joeboy. Status code: 429"", ""Error occurred while searching for the artist J Hus. Status code: 429"", ""Error occurred while searching for the artist Victony. Status code: 429"", ""Error occurred while searching for the artist Tiwa Savage. Status code: 429"", ""Error occurred while searching for the artist Kudos. Status code: 429"", ""Error occurred while searching for the artist Marstein. Status code: 429"", ""Error occurred while searching for the artist UNDERGRUNN. Status code: 429"", ""Error fetching related artists for DJ MøMø. Status code: 429"", ""Error fetching related artists for Delara. Status code: 429"", ""Error occurred while searching for the artist Beathoven. Status code: 429"""
Bausa,"Dardan, Lil Lano, Majoe, KitschKrieg, Miami Yacine, Trettmann, Olexesh, PA Sports, Nura, KC Rebell, reezy, Marvin Game, Kay One, Sun Diego, Mert, Azzi Memo, Sierra Kidd, Jamule, Veysel, Summer Cem"
Golfklubb,"HENK, Fatso, BABELAID, Prells, Segertåget, KNEKT, Problembarn, NIL$$EN, Norwegian House Mafia, CA$HMERE, Streetboys, Institusjonen, Kudos, DØNDER, Hundehuset, b.G, Kursiv, Phill, Dr. Disco, Voldtechno"
brvge,"FEAN, Tennisklubben, KANSELLERT, Rike Venner, Oven, Traphouse, Golfklubb, lille Caesar, Yung Slippy, Makosir, Henrik von Grogg, Bølgen, William Gamborg, Chris Abolade, Problembarn, Bausa, Lasse2, 3TOS, Klikkmonopolet, Beathoven"
Ballinciaga,"Beathoven, Blackie, Kris Winther, Bausa, Roc Boyz, Klikkmonopolet, Den BB, Chris Abolade, Kamelen, UNDERGRUNN, Broiler, Morgan Sulele, Dr. Disco, Hkeem, Soppgirobygget, b.G, Marstein, Phill, Rike Venner, Kudos"
Albin Lee Meldau,"Miriam Bryant, Sarah Klang, Linnea Henriksson, Oskar Linnros, Melissa Horn, Molly Hammar, Anna Ternheim, Daniel Adams-Ray, Moonica Mac, Maja Francis, Sara Zacharias, Lancelot, Lars Winnerbäck, Anders Robert, Thomas Stenström, Daniela Rathana, Ana Diaz, Sabina Ddumba, Newkid, Gustaf & Viktor Norén"
Emma Steinbakken,"Isah, Kristian Kristensen, Synne Vo, Victoria Nadine, Blackie, Ramón, Chris Holsten, Ingebjørg Bratland, Karoline Krüger, Hkeem, Sondre Justad, Bjørn Eidsvåg, vinni, Gabrielle, Hver gang vi møtes, Delara, Morgan Sulele, Chris Abolade, Ruben, Vidar Villa"
Broiler,"Sandra Lyng, Freddy Kalas, Jesper Jenset, Julie Bergan, Unge Ferrari, Ina Wroldsen, CLMD, Kjartan Lauritzen, Den BB, Beathoven, Morgan Sulele, Blackie, Kris Winther, Bausa, Ballinciaga, Kamelen, Soppgirobygget, Donkeyboy, Roc Boyz, Cir.Cuz"
Blackie,"Goody Grace, Call Me Karizma, mansionz, YUNGBLUD, Christian French, Trevor Daniel, Quinn XCII, Marc E. Bassy, 24kGoldn, Jon Bellion, PLVTINUM, Hoodie Allen, Bryce Vine, gianni & kyle, KYLE, Skizzy Mars, Lost Kings, MOD SUN, Xuitcasecity, EDEN"
Postgirobygget,"CC Cowboys, Trang Fødsel, D.D.E., Di Derre, Hellbillies, Luxus Leverpostei, Bjørn Hellfuck, Vinskvetten, Dance With A Stranger, Morten Abel, Banana Airlines, deLillos, Øystein Sunde, Åge Aleksandersen, Jokke & Valentinerne, Karpe, Paperboys, Vestlandsfanden, Vømmøl Spellmannslag, Raga Rockers"
lille Caesar,"Oven, Makosir, Aiba, William Gamborg, Cobros 2023, Natnael, Chris Abolade, Jon Ranes, Hkeem, Turab, Amara, Problembarn, Dutty Dior, Jonathan Floyd, Ramón, Golfklubb, Bausa, Jonas Benyoub, Tennisklubben, Stig Brenner"
Hagle,"Paramore, PVRIS, Tonight Alive, VersaEmerge, Frank Iero, The Maine, HalfNoise, Lights, Now, Now, Elke, Julien Baker, Orla Gartland, Gerard Way, You Me At Six, The Aces, We Are The In Crowd, The Regrettes, Allie X, Sky Ferreira, Lucy Dacus, "
Dagny,"Julie Bergan, Fay Wildhagen, Jesper Jenset, Highasakite, Ina Wroldsen, Anna of the North, dePresno, Kristian Kristensen, Chris Holsten, Emilie Nicolas, Amanda Tenfjord, Daniel Kvammen, Inge Bremnes, Ingebjørg Bratland, SKAAR, Emelie Hollow, Sondre Justad, Eva Weel Skram, Broiler, Victoria Nadine"
Karpe,"Postgirobygget, Jaa9 & Onklp, Erik Og Kriss, Paperboys, Admiral P, Lars Vaular, Klovner I Kamp, Cezinando, AF1, Jonas Benyoub, Bjørn Hellfuck, Odd Nordstoga, vinni, deLillos, CC Cowboys, Kjartan Lauritzen, Vamp, Trang Fødsel, Vassendgutane, Kaizers Orchestra"
Morgan Sulele,"Innertier, Staysman & Lazz, Admiral P, Cir.Cuz, Katastrofe, Vidar Villa, Plumbo, Erik Og Kriss, Carina Dahl, Jonas Benyoub, Robin og Bugge, Skei & PT, Stavangerkameratene, Broiler & Sirkus Eliassen, Staysman, Sval, DJ Borgny, AF1, RykkinnFella, D.D.E."
Roc Boyz,"Dr. Disco, Dolla$Bae, AK97, Melkers, Soppgirobygget, Kris Winther, Kursiv, Mad.S, Sportsalleen, Den BB, Huemist, Juur, ZL, El Papi, Solguden & Mannen, Chris Abolade, Bausa, Klikkmonopolet, Truse Tarzan, Beathoven"
Ringnes-Ronny,"Studavigå, Öresus, Truse Tarzan, Kuselofte, Thomassen & Berg, BEK & Moberg, Snuskebazn, Soppgirobygget, DJ Pøssycat, Den BB, INAP, Kevin Boine, El Papi, Solguden & Mannen, BEK & Wallin, Heux, DJ Loppetiss, Juur, Robin Veela, Fakkboiz"
William Gamborg,"Makosir, Natnael, Oven, Aiba, lille Caesar, Turab, Jonathan Floyd, Jesper Jenset, Chris Abolade, Jonas Benyoub, Stig Brenner, Hkeem, Oscar Blesson, Dutty Dior, Amara, Ramón, Bargee, 06 Boys, Jon Ranes, AVGVSTVS"
