Artist,Related Artists
Myke Towers,"Brytiago, Bryant Myers, Nio Garcia, Lary Over, Amenazzy, Rvssian, Alex Rose, Lunay, Miky Woodz, DJ Luian, Casper Magico, KEVIN ROLDAN, Noriel, Jon Z, Chris Jedi, Jhayco, Anuel AA, Rauw Alejandro, Darell, Dalex"
LIT killah,"KHEA, Duki, Tiago PZK, Paulo Londra, WOS, Trueno, Midel, Seven Kayne, DrefQuila, FMK, Frijo, Neo Pistea, KAKTOV, Nicki Nicole, Lautaro Lopez, Blunted Vato, Bhavi, YSY A, Wolty, Marcianos Crew"
Maria Becerra,"Emilia, Rusherking, Lali, MYA, FMK, Luck Ra, Rei, Migrantes, La Joaqui, Alan Gomez, Karina, Tincho Di Salvo, Yami Safdie, j mena, ECKO, Nicki Nicole, DJ Tao, Gusty dj, BM, Chano"
Big One,"FMK, Tincho Di Salvo, Sound De Barrio, Migrantes, Onda Sabanera, La Roca Callejera, Matías Valdez, Rusherking, The La Planta, Luck Ra, SOLARI DJ, El Rodri, BM, Roman El Original, Callejero Fino, Nissa, La T y La M, La Kuppe, Axel Caram, Rei"
Tiago PZK,"LIT killah, Midel, KHEA, Nicki Nicole, Trueno, FMK, Seven Kayne, Duki, WOS, Bhavi, YSY A, Neo Pistea, Frijo, Rusherking, Dani Ribba, Rei, Emilia, MYA, ECKO, Yami Safdie"
Emilia,"Marama, Lali, Rusherking, MYA, FMK, Rei, Maria Becerra, Migrantes, j mena, Luck Ra, Yami Safdie, Angela Torres, La Joaqui, Alan Gomez, Chano, LIT killah, Nicki Nicole, ECKO, Koino Yokan, Tiago PZK"
Yng Lvcas,"Milo Mae, El Bogueto, El Malilla, Cindy & Mei, Uzielito Mix, Bellakath, Alu Mix, Dj Mon8, Tito Double P, Gabito Ballesteros, Super Yei, Johann Rz, Pablito Mix, El Chachito, El Predicador, Oscar Maydon, Eme MalaFe, KEVIN ROLDAN, Ovi, Javiielo"
Nicki Nicole,"Tiago PZK, LIT killah, KHEA, Trueno, WOS, Midel, FMK, Neo Pistea, YSY A, Rusherking, Seven Kayne, Emilia, Frijo, Dani Ribba, Bhavi, Emanero, Rei, Mesita, Yami Safdie, ECKO"
Feid,"Lunay, Blessd, Nio Garcia, Myke Towers, Manuel Turizo, Andy Rivera, Danny Ocean, Dalex, Sech, Yandel, Cazzu, KEVIN ROLDAN, Mike Bahía, Alex Rose, Brytiago, Rauw Alejandro, Rich Music LTD, Chris Jedi, Justin Quiles, Mora"
Ke Personajes,"La T y La M, The La Planta, El Rodri, Mario Luis, ""Q Lokura"", Roman El Original, BM, Leo Mattioli, Los del Fuego, Nestor En Bloque, Tincho Di Salvo, La Nueva Luna, Damas Gratis, Luck Ra, Banda XXI, 18 Kilates, Ulises Bueno, Axel Caram, Damián Córdoba, DJ Alex"
Luck Ra,"Tincho Di Salvo, Migrantes, Rusherking, The La Planta, Rei, FMK, El Reja, MYA, Axel Caram, El Rodri, ECKO, SOLARI DJ, La T y La M, ""Q Lokura"", ""Dale Q Va"", Matías Valdez, Emanero, Damián Córdoba, Roman El Original, Banda XXI"
Mesita,"Pekeño 77, 44 Kid, Midel, Santoz, Falke 912, Lucho SSJ, Neo Pistea, Frijo, Lukessj, Obie Wanshot, Blunted Vato, VisarraSSJ, Marcianos Crew, Asan, Después de la fiesta, Bhavi, Franux BB, Muerejoven, Tobi, ill quentin"
BM,"JayteKz, Nate Feuerstein, Zimm, CHVSE, Enkay47, PFV, Bingx, Jdam, Problematic, Kam Michael, CalenRaps, Taran Jaber, ANTH, Mikelwj, Promoting Sounds, Colicchie, Mass of Man, Ekoh, Dtrue, Gremlin"
Grupo Frontera,"Secretto, De Parranda, Los Dorados, La Pocima Norteña, La Maquinaria Norteña, La Fiera de Ojinaga, Los Pescadores Del Rio Conchos, La Zenda Norteña, Los 2 de la S, La Energia Nortena, Conjunto Rienda Real, Los Avila, Grupo Legitimo, Gerardo Coronel, Retoños Del Rio, Eden Muñoz, Los Elegantes de Jerez, Nathan Galante, La Escencia Para Ti, Duelo"
Bad Bunny,"Jhayco, Chris Jedi, Nio Garcia, Mau y Ricky, Ozuna, Brytiago, Anuel AA, KAROL G, Tainy, Bryant Myers, Myke Towers, Rauw Alejandro, Ñengo Flow, Miky Woodz, Alex Rose, Rvssian, Lunay, KEVIN ROLDAN, Jon Z, Lary Over"
The La Planta,"El Reja, La Kuppe, El Mala, El Rodri, La Roca Callejera, SOLARI DJ, Marka Akme, Lira, Axel Caram, Roman El Original, DJ Alex, El negro tecla, Tincho Di Salvo, La Fase Buk, Migrantes, Jona Mix, Perro Primo, Cumbia a Fondo, De La Calle, Locura Mix"
Bizarrap,"Trueno, FMK, YSY A, Neo Pistea, Eladio Carrion, WOS, La Joaqui, LIT killah, Seven Kayne, Tiago PZK, Nicki Nicole, KHEA, Duki, Bhavi, Paulo Londra, ECKO, Kidd Keo, Alan Gomez, L-Gante, Rusherking"
Taiu,"J Gonz, Juan Solo, MP El Juvenil, Pema, NEUEN, Canals, Trueno, Milo j, TATOOL, Dany Martin, Franco Luciani, Luciana Jury, Ptazeta, Julieta Venegas, NATHY PELUSO"
Eslabon Armado,"DannyLux, Ivan Cornejo, Nivel Codiciado, Los Del Limit, LDNE, Oscar Maydon, Esteban Gabriel, Marca MP, T3R Elemento, Gabito Ballesteros, Herencia de Patrones, Polo Gonzalez, Chino Pacas, Edgardo Nuñez, Porte Diferente, Calle 24, Los Gemelos De Sinaloa, LEGADO 7, Grupo Los de la O, Victor Cibrian"
Duki,"LIT killah, KHEA, Bhavi, Paulo Londra, Seven Kayne, WOS, Neo Pistea, Kidd Keo, Trueno, YSY A, Tiago PZK, Midel, ACRU, DrefQuila, FMK, La Joaqui, Cazzu, Nicki Nicole, Cruz Cafuné, Kaydy Cain"
Alan Gomez,"Kevo DJ, Axel Caram, Dj Lauuh, Papichamp, Dani Cejas, Maty Deejay, Chiky Dee Jay, Fer Palacio, L-Gante, Fedu DJ, El Nikko DJ, Emus DJ, El Apache Ness, La Kuppe, DJ Pirata, Papacho Mc Caco, La Joaqui, Los Nota Lokos, ECKO, DJ Alex"
Quevedo,"Saiko, Alejo, Rvfv, Omar Montes, Funzo & Baby Loud, DELLAFUENTE, Maikel Delacalle, YoSoyPlex, Cruz Cafuné, Mora, Cano, Natos y Waor, Rei, Tiago PZK, Lola Indigo, Delaossa, Pole., Recycled J, FERNANDOCOSTA, Jhayco"
Damas Gratis,"Yerba Brava, La Base, El Polaco, Los Pibes Chorros, Mala Fama, Repiola, Amar Azul, Los Charros, La Liga, Leo Mattioli, Los Palmeras, Meta Guacha, Pala Ancha, Dalila, Nestor En Bloque, La Repandilla, Jambao, Supermerk2, Mario Luis, Escucha!"
Yahritza Y Su Esencia,"Los Del Limit, Erick B, ERRE, LDNE, Officialalex425, Porte Diferente, Ivan Cornejo, Nivel Codiciado, Fabiø Guerra, La Pocima Norteña, Los Aptos, Ulices Chaidez, Grupo Triple L, Omar Rodriguez, DannyLux, Esteban Gabriel, Conjunto Rienda Real, Leonilo Jaimes, Angel Perez, Los Primos del Este"
LiL CaKe,"Asan, Falke 912, Oscu, Midel, Tobi, Kifykify, Tygas, Lautaro Lopez, Panther, Frijo, Migrantes, OKY, Pekeño 77, Lucho SSJ, Seven Kayne, 44 Kid, Dani Ribba, Mesita, John C, Neo Pistea"
Milo j,"Mesita, Seven Kayne, Zeballos, Bhavi, YSY A, Canals, Dani Ribba, COSMIC KID, Dillom, Emanero, Lucho SSJ, Midel, UNIVERSE, Rei, Bardero$, Neo Pistea, Panther, Jaze, Trueno, Después de la fiesta"
Yandel,"De La Ghetto, Wisin, Zion & Lennox, Jowell & Randy, Trebol Clan, Nicky Jam, Zion, Ñejo, Dalmata, Alexis y Fido, Tony Dize, Tego Calderón, Arcángel, Cosculluela, Baby Rasta & Gringo, DJ Nelson, Luny Tunes, Ivy Queen, Farruko, Tito ""El Bambino"""
Miranda!,"Lady A, Ashley McBryde, Maddie & Tae, Little Big Town, The Band Perry, Carrie Underwood, Cam, Pistol Annies, Sugarland, Danielle Bradbery, Lauren Alaina, Sara Evans, Gretchen Wilson, Trisha Yearwood, Maren Morris, Martina McBride, Jo Dee Messina, Keith Urban, Kellie Pickler, Dierks Bentley"
KAROL G,"Nio Garcia, Mau y Ricky, Greeicy, Sebastian Yatra, Manuel Turizo, Chris Jedi, Ozuna, Cazzu, Jhayco, Lunay, Sofía Reyes, CNCO, Nacho, Danny Ocean, Myke Towers, Rauw Alejandro, NATTI NATASHA, Piso 21, Mario Bautista, Manuel Medrano"
TINI,"Mau y Ricky, Rombai, Tiago PZK, Greeicy, Mike Bahía, MYA, Emilia, Lali, Maria Becerra, Sofía Reyes, Rusherking, Aitana, Luck Ra, La Joaqui, Migrantes, Marama, FMK, Abraham Mateo, Yami Safdie, Cali Y El Dandee"
Rauw Alejandro,"Amenazzy, DJ Luian, Myke Towers, Alex Rose, Lunay, Casper Magico, Nio Garcia, Brytiago, Bryant Myers, Miky Woodz, Chris Jedi, Ozuna, Jhayco, Rvssian, Lary Over, Jon Z, Cauty, Blessd, Mau y Ricky, Noriel"
DJ Tao,"DJ Alex, Perro Primo, Alejo Isakk, ECKO, EL NOBA, Salastkbron, Kaleb Di Masi, Gusty dj, Alan Gomez, El negro tecla, Callejero Fino, Papichamp, Locura Mix, Tirri La Roca, Eze Remix, Axel Caram, Mambo DJ, Rei, Los Nota Lokos, El Rodri"
Sky Rompiendo,"Lalo Ebratt, Randy, Valentino, Sael, Cauty, ICON, Blessd, Rafa Pabön, Eix, Llane, Yera, Maxiolly, Los Legendarios, Dímelo Flow, Lyanno, Haze, Milly, Reykon, Anonimus, Club16"
Manuel Turizo,"Sebastian Yatra, Greeicy, CNCO, Chris Jedi, Danny Ocean, Mau y Ricky, Lalo Ebratt, Mario Bautista, Mike Bahía, Nio Garcia, Nacho, Piso 21, Sofía Reyes, Andy Rivera, Lunay, Wisin, Rvssian, NATTI NATASHA, Alkilados, Zion & Lennox"
Dave,"J Hus, Fredo, Hardy Caprio, SL, Young T & Bugsey, JAY1, AJ Tracey, Steel Banglez, Nines, Bugzy Malone, MIST, Octavian, Avelino, Krept & Konan, One Acen, Stormzy, MoStack, Giggs, Tion Wayne, M1llionz, "
Olivia Rodrigo,"Ashe, Joshua Bassett, Conan Gray, Gracie Abrams, Sabrina Carpenter, Madison Beer, Tate McRae, Nessa Barrett, Ruth B., Lizzy McAlpine, Clinton Kane, Julia Michaels, Lauren Spencer Smith, Reneé Rapp, Louis Tomlinson, ""Olivia OBrien"", Noah Cyrus, FINNEAS, NIKI, Troye Sivan"
Taylor Swift,"Demi Lovato, Selena Gomez, Alessia Cara, Harry Styles, Katy Perry, Niall Horan, Camila Cabello, Meghan Trainor, Halsey, Selena Gomez & The Scene, Fifth Harmony, One Direction, Ariana Grande, The 1975, Jonas Brothers, Troye Sivan, 5 Seconds of Summer, Dua Lipa, Louis Tomlinson, Little Mix"
Morgan Wallen,"Dustin Lynch, Jordan Davis, Dylan Scott, Kane Brown, Chris Lane, Dan + Shay, Jon Pardi, Luke Combs, Thomas Rhett, Michael Ray, Riley Green, Lee Brice, Florida Georgia Line, Jon Langston, Ryan Hurd, Cole Swindell, Luke Bryan, Old Dominion, Jake Owen, Mitchell Tenpenny"
Luke Combs,"Jordan Davis, Dylan Scott, Thomas Rhett, Chris Lane, Kane Brown, Dustin Lynch, Lee Brice, Jon Pardi, Florida Georgia Line, Dan + Shay, Morgan Wallen, Luke Bryan, Michael Ray, Jake Owen, Cole Swindell, Justin Moore, Ryan Hurd, Brothers Osborne, Kip Moore, Jason Aldean"
David Kushner,"Chance Peña, Sky McCreery, Tom Rosenthal, sombr, normal the kid, Rowan Drake, Edith Whiskers, Brenn!, Jonah Kagen, Lissom, Thomas Day, Richy Mitch & The Coal Miners, John Vincent III, mehro, Zackery, Alex Warren, Zach Hood, Matt Hansen, Montell Fish, Hayd"
Gunna,"Pi’erre Bourne, Young Nudy, Don Toliver, Lil Keed, UnoTheActivist, SahBabii, Lil Baby, Quavo, D. Savage, Kodak Black, 21 Savage, Roddy Ricch, Young Thug, Lil Yachty, Sheck Wes, Yung Bans, 03 Greedo, Flipp Dinero, NAV, A$AP ANT"
The Weeknd,"PARTYNEXTDOOR, Brent Faiyaz, Bryson Tiller, Jeremih, 6LACK, Roy Woods, Miguel, Daniel Caesar, Tory Lanez, Khalid, SZA, Bazzi, Chase Atlantic, Jhené Aiko, Summer Walker, Majid Jordan, H.E.R., Frank Ocean, Don Toliver, NAV"
Miley Cyrus,"Hannah Montana, Demi Lovato, Noah Cyrus, Kelly Clarkson, Selena Gomez & The Scene, Jonas Brothers, Tove Lo, Jessie J, Hailee Steinfeld, Reneé Rapp, Mark Ronson, Julia Michaels, FLETCHER, Rita Ora, ELIO, Fergie, Mimi Webb, Zara Larsson, Lizzo, Kesha"
Harry Styles,"Niall Horan, Louis Tomlinson, Liam Payne, Phoebe Bridgers, 5 Seconds of Summer, Alessia Cara, Hailee Steinfeld, One Direction, Dua Lipa, The 1975, The Vamps, Ashe, Julia Michaels, Declan McKenna, Sabrina Carpenter, Jonas Brothers, THE DRIVER ERA, Ruel, Shawn Mendes, Nick Jonas"
SZA,"Kali Uchis, H.E.R., Kehlani, Alina Baraz, Kiana Ledé, Jhené Aiko, Sabrina Claudio, SiR, Ella Mai, Jorja Smith, Doja Cat, Chloe x Halle, Tinashe, Omar Apollo, PARTYNEXTDOOR, Summer Walker, Daniel Caesar, Smino, Victoria Monét, Miguel"
PinkPantheress,"Coco & Clair Clair, Faye Webster, Luci4, Kanii, Eyedress, Azealia Banks, Riovaz, Strawberry Guy, beabadoobee, Bktherula, jnhygs, Dreamer Isioma, Macabre Plaza, Lamp, TV Girl, piri, 9lives, Kempachii, Alex G, Men I Trust"
OneRepublic,"The Fray, The Script, American Authors, Maroon 5, Gavin DeGraw, Phillip Phillips, Imagine Dragons, Snow Patrol, Neon Trees, Keane, Owl City, Parachute, Mat Kearney, Lifehouse, James Arthur, Andy Grammer, Five For Fighting, ""Plain White Ts"", WALK THE MOON, Daughtry"
Zach Bryan,"Flatland Cavalry, Wyatt Flores, Muscadine Bloodline, Sam Barber, Tanner Usrey, Koe Wetzel, 49 Winchester, Southall, Charles Wesley Godwin, Parker McCollum, Josh Meloy, Ian Munsick, Pecos & the Rooftops, Matt Schuster, Riley Green, Tyler Childers, Turnpike Troubadours, Treaty Oak Revival, Whiskey Myers, Corey Kent"
Post Malone,"Rae Sremmurd, Huncho Jack, A$AP Ferg, Tyla Yaweh, 6LACK, Desiigner, Quality Control, Migos, Quavo, The Kid LAROI, NAV, SAINt JHN, Fetty Wap, Lil Mosey, Bazzi, Arizona Zervas, Young Thug, Jaden, G-Eazy, mike."
Vance Joy,"The Lumineers, Mumford & Sons, Gregory Alan Isakov, The Head And The Heart, James Bay, George Ezra, The Paper Kites, Houndmouth, Of Monsters and Men, Passenger, Hozier, Bronze Radio Return, Mt. Joy, Noah Kahan, Dustin Tebbutt, Hollow Coves, Woodlock, Bahamas, Wild Rivers, Thelma Plum"
Metro Boomin,"Quavo, 21 Savage, Don Toliver, Gunna, Lil Uzi Vert, Huncho Jack, Lil Baby, Young Nudy, Lil Yachty, Kodak Black, NAV, Roddy Ricch, Quality Control, Sheck Wes, Young Thug, Migos, Lil Keed, Rich The Kid, Trippie Redd, Comethazine"
NewJeans,"STAYC, NMIXX, IVE, LE SSERAFIM, aespa, XG, IZ*ONE, Red Velvet, Kep1er, fromis_9, LOONA, NAYEON, ITZY, BIBI, tripleS, JEON SOMI, (G)I-DLE, GFRIEND, CHUNG HA, OH MY GIRL"
Nicki Minaj,"Iggy Azalea, Kehlani, Fergie, Cardi B, Bhad Bhabie, Ciara, Azealia Banks, Normani, Chloe x Halle, BIA, Megan Thee Stallion, Teyana Taylor, City Girls, Tinashe, will.i.am, Saweetie, Trey Songz, The Carters, Latto, Young Money"
Lil Durk,"Chief Keef, Shy Glizzy, Moneybagg Yo, Key Glock, Rich Homie Quan, Doe Boy, Young Dolph, Tee Grizzley, G Herbo, YFN Lucci, Young Scooter, Fredo Santana, YoungBoy Never Broke Again, Only The Family, Lud Foe, Quando Rondo, Lil Reese, FBG Duck, Roddy Ricch, Blac Youngsta"
Dua Lipa,"Rita Ora, Camila Cabello, Ellie Goulding, Fifth Harmony, DNCE, Selena Gomez, Jess Glynne, Alessia Cara, Tove Lo, Halsey, Katy Perry, Demi Lovato, Jessie J, Anne-Marie, Sia, Mabel, Bebe Rexha, Hailee Steinfeld, Clean Bandit, Julia Michaels"
FIFTY FIFTY,"tripleS, STAYC, YENA, JO YURI, fromis_9, Billlie, HUH YUNJIN, NAYEON, SEULGI, LEE CHAE YEON, LOONA, PURPLE KISS, Wonder Girls, XG, WJSN, Kep1er, KISS OF LIFE, VIVIZ, Cherry Bullet, GOT the beat"
Lewis Capaldi,"James Bay, James TW, Rhys Lewis, Dermot Kennedy, Declan J Donovan, Dean Lewis, Ryan McMullan, Calum Scott, Anson Seabra, James Arthur, Alexander Stewart, JP Saxe, Gavin James, Tom Walker, Ella Henderson, Etham, Picture This, Tom Grennan, James Smith, Cian Ducrot"
Calvin Harris,"David Guetta, Jonas Blue, The Chainsmokers, Kygo, Martin Jensen, Lost Frequencies, Sigala, Jax Jones, Kungs, Cheat Codes, Loud Luxury, Felix Jaehn, Galantis, Robin Schulz, Alesso, Sam Feldt, Zedd, Major Lazer, Axwell /\\ Ingrosso, Martin Garrix"
Rema,"Ayra Starr, Ruger, Wande Coal, Victony, SPINALL, Olamide, Lojay, Joeboy, Adekunle Gold, Bnxn, Pheelz, Mayorkun, Reekado Banks, Young Jonn, Tiwa Savage, Oxlade, Mavins, Blaqbonez, Rexxie, ODUMODUBLVCK"
J. Cole,"Big Sean, Wale, Pusha T, ScHoolboy Q, 2 Chainz, Meek Mill, Jay Rock, Kendrick Lamar, A$AP Rocky, Kid Cudi, Nipsey Hussle, Rick Ross, Freddie Gibbs, YG, Joey Bada$$, Isaiah Rashad, Chance the Rapper, Lupe Fiasco, A$AP Ferg, Dreamville"
Bonez MC,"Dardan, Majoe, Olexesh, Lil Lano, Bausa, Miami Yacine, PA Sports, Zuna, RAF Camora, 187 Strassenbande, Azzi Memo, Gzuz, Veysel, Shindy, KC Rebell, Kurdo, Farid Bang, Summer Cem, Mert, Sa4"
Ski Aggu,"$OHO BANI, Longus Mongus, Ion Miles, Sampagne, Whitey en vogue, viko63, Gustav, 01099, BHZ, makko, Dead Dawg, Endzone, Ocboyblau, Lugatti & 9ine, Yung Hurn, Rowli, Symba, Monk, badchieff, 102 Boyz"
RAF Camora,"Fard, Summer Cem, Haftbefehl, Nazar, Celo & Abdi, Farid Bang, Kollegah, Nate57, AZAD, Massiv, Bushido, Chakuza, Kay One, MoTrip, XATAR, PA Sports, RAF 3.0, Marc Reis, Kool Savas, Silla"
Luca-Dante Spadafora,"NoooN, Niklas Dee, Sääftig, Jiyagi, The Holy Santa Barbara, Pazoo, LUZI, KXXMA, MartinBepunkt, Nils_Gucki, Romero, Hornpub.de, Tinderino, TEKKISLOVE, BroyS, N02H, Habe & Dere, SpriTEKK, HAEHNCHENTEIlE, Die Gebrüder Brett"
Udo Lindenberg,"Heinz Rudolf Kunze, Klaus Lage, BAP, Herbert Grönemeyer, Ina Müller, Silly, Westernhagen, Rosenstolz, Peter Maffay, Fury In The Slaughterhouse, Reinhard Mey, Extrabreit, Rio Reiser, Ich + Ich, City, Annett Louisan, Karat, Pur, Wolf Maahn, Udo Lindenberg & Das Panik-Orchester"
Yung Yury,"Damn Yury, erobé, Romero, Liaze, Pbb Yea, LOST, BroyS, selfyy, lityway, Cloud, Akros, Rill, Rowli, nasskalt., AyVe, TheDoDo, Schillah, Boyka, nullsechsroy, Dennis Dies Das"
Dardan,"Azzi Memo, Miami Yacine, Mert, Zuna, Olexesh, Nash, Bausa, King Khalil, Majoe, Lil Lano, Kurdo, PA Sports, Veysel, Nimo, Summer Cem, KC Rebell, Bonez MC, KALIM, reezy, GRiNGO"
Niklas Dee,"FVTM, DJSM, Octavian, Robbe, Luca-Dante Spadafora, SP3CTRUM, Bisken, LUZI, Clubhunterz, Red Maple, LOST, MartinBepunkt, Syntro, Pazoo, Romero, Damn Yury, KXXMA, Zombic, Yung Yury, Cim & Skinz, "
Tiësto,"Martin Garrix, R3HAB, DVBBS, Loud Luxury, Dimitri Vegas & Like Mike, Martin Jensen, KSHMR, Lucas & Steve, Cheat Codes, David Guetta, Gryffin, VINAI, Sigala, Jax Jones, Lost Frequencies, Mike Perry, Oliver Heldens, Syn Cole, Don Diablo, Alesso"
Miksu / Macloud,"FOURTY, t-low, CIVO, ART, Rowli, LUIS, kid kapri, lityway, The Cratez, Samo104, $OHO BANI, Jamule, Ion Miles, Liaze, Bausa, KASIMIR1441, 01099, Sampagne, Gustav, Chapo102"
David Guetta,"Calvin Harris, R3HAB, Avicii, Galantis, The Chainsmokers, Tiësto, Sigala, Martin Jensen, Jax Jones, Loud Luxury, Cheat Codes, Years & Years, VINAI, Alesso, Dimitri Vegas & Like Mike, Cash Cash, Robin Schulz, Syn Cole, KSHMR, Martin Garrix"
SIRA,"Dog Blood, Popeska, JOYRYDE, Varien, Skrillex, Savant, i SQUARE, Sofi, Rudebrat, 0SM, Modigs, Cenob1te, Kairo Kingdom, Omnitica, Kezwik, MitiS, Ry Legit, DEAD BATTERY, Eptic, I See MONSTAS"
Casper,"Miky Woodz, Noriel, Cauty, DJ Luian, Lary Over, Revol, Amenazzy, Jory Boy, Rvssian, Alex Rose, Darell, Chris Jedi, Bryant Myers, Brytiago, Jon Z, Chris Wandell, Yampi, Anonimus, Juanka, Nio Garcia"
Ricchi E Poveri,"Pupo, Toto Cutugno, Riccardo Fogli, Umberto Tozzi, Al Bano And Romina Power, Gianni Morandi, Amedeo Minghi, Al Bano, Viola Valentino, Adriano Celentano, Peppino Di Capri, Drupi, Matia Bazar, Little Tony, I Santo California, Tony Dallara, Massimo Ranieri, Gianni Togni, Loretta Goggi, Domenico Modugno"
Creeds,"Dutch Hour, Creeds | Hardside, ""Vorteks"", JKLL, Vlinder Vos, Basswell, UNLOGIX, Sköne, Protokseed, Maddix, Indecorum, El Desperado, Restricted, OMAKS, ZAPRAVKA, Reinier Zonneveld, Billx, Stan Christ, Vieze Asbak, VCL"
Eminem,"D12, The Game, Bad Meets Evil, DMX, Dr. Dre, 50 Cent, Hopsin, G-Unit, Tech N9ne, Snoop Dogg, Ice Cube, Xzibit, N.W.A., Obie Trice, T.I., Yelawolf, The Notorious B.I.G., Eazy-E, Ludacris, Joyner Lucas"
Jain,"Therapie TAXI, Diva Faune, Hoshi, Juliette Armanet, Clara Luciani, Eddy de Pretto, Suzane, Bon Entendeur, Tim Dup, Pomme, Feu! Chatterton, Hyphen Hyphen, Voyou, Cats On Trees, Elephanz, Talisco, Yodelice, L.E.J, Camp Claude, Izïa"
Loreen,"Danny Saucedo, Eric Saade, Linnea Henriksson, Molly Hammar, Norlie & KKV, Darin, Charlotte Perrelli, Jon Henrik Fjällgren, Ulrik Munther, Agnes, Måns Zelmerlöw, Dolly Style, Molly Sandén, Linda Bengtzing, Panetoz, Thomas Stenström, Anna Bergendahl, Wiktoria, Lena Philipsson, Sean Banan"
AYLIVA,"Milano, Hava, Lune, Eddin, ARY, Mudi, Menoa, Nisa, Morpheuz, Jazeek, CÉLINE, DELA, Florentina, JIGGO, badmómzjay, KATI K, LUNA, Dardan, MC Bilal, Yusuf & Yasin"
Tom Odell,"James Bay, flora cash, Aquilo, Passenger, Andrew Belle, Seafret, Amber Run, Jaymes Young, SYML, Kodaline, Anna Leone, BANNERS, Tom Rosenthal, Rhys Lewis, Birdy, Dermot Kennedy, Charlie Cunningham, Tom Walker, Novo Amor, Lissom"
Nina Chuba,"Paula Hartmann, Lostboi Lino, Provinz, MAJAN, ENNIO, Schmyt, CÉLINE, Trettmann, KUMMER, badmómzjay, Dominik Hartz, Rubi, Mayberg, KitschKrieg, JEREMIAS, Juju, Montez, KAFFKIEZ, LUNA, Dilla"
Milky Chance,"Portugal. The Man, FIL BO RIVA, Lewis Del Mar, Von Wegen Lisbeth, Young the Giant, NoMBe, Coast Modern, alt-J, GROUPLOVE, Henry And The Waiter, KYTES, Giant Rooks, Leoniden, Cold War Kids, Sean Koch, zeck, The Palms, Benjamin Amaru, Dekker, Sir Sly"
Macklemore & Ryan Lewis,"Macklemore, Hoodie Allen, Chiddy Bang, Mike Posner, Lil Dicky, Watsky, G-Eazy, Classified, B.o.B, E-Dubble, Hilltop Hoods, Gym Class Heroes, X Ambassadors, LMFAO, Rudimental, will.i.am, Iggy Azalea, Bliss n Eso, Logic, SonReal"
Purple Disco Machine,"WEISS, Superlover, Mark Knight, Tensnake, The Shapeshifters, GAMPER & DADONI, Junior Jack, Bakermat, Kungs, Sophie and the Giants, Claptone, Angelo Ferreri, David Penn, twocolors, Ofenbach, YouNotUs, Felix Jaehn, Ferreck Dawn, Block & Crown, Me & My Toothbrush"
Ion Miles,"Dead Dawg, Longus Mongus, Monk, Big Pat, MotB, KazOnDaBeat, BHZ, RAPK, Lugatti, Lugatti & 9ine, 9inebro, Chapo102, nikan, Whitey en vogue, badchieff, Sampagne, $OHO BANI, XAVER, TYM, Yin Kalle"
1099,"Flowidus, Aktive, Krakota, Freaks & Geeks, Grafix, Fourward, Millbrook, Culture Shock, Andromedik, Fred V, Bensley, Kove, ShockOne, K Motionz, Friction, Subsonic, Document One, Delta Heavy, The Prototypes, Metrik"
Don Omar,"Tego Calderón, Alexis y Fido, Tony Dize, De La Ghetto, Trebol Clan, Zion, Luny Tunes, Tito ""El Bambino"", Jowell & Randy, Ivy Queen, Zion & Lennox, Wisin, Angel Y Khriz, Nicky Jam, Wisin & Yandel, Ñejo, Baby Rasta & Gringo, Dalmata, Daddy Yankee, Arcángel"
Heronwater,"YUNGWAY, PINQ, elyaplugg!, FENDIGLOCK, Kai Angel, SEEMEE, Toxi$, LILDRUGHILL, 9mice, August, FRIENDLY THUG 52 NGG, THRILL PILL, blago white, ALBLAK 52, nkeeei, PLOHOYPAREN, 4n Way, 163ONMYNECK, MAYOT, Шайни"
Aarne,"SEEMEE, PINQ, nkeeei, LIL KRYSTALLL, blago white, YUNGWAY, BUSHIDO ZHO, THRILL PILL, LILDRUGHILL, OBLADAET, Heronwater, Yanix, August, FRIENDLY THUG 52 NGG, MAYOT, 163ONMYNECK, ALBLAK 52, PLOHOYPAREN, Молодой Платон, SODA LUV"
xxxmanera,"PLOHOYPAREN, August, 163ONMYNECK, BUSHIDO ZHO, LIL MORTY, ROCKET, LIL KRYSTALLL, quiizzzmeow, Mosquit, Heronwater, Шайни, PINQ, Платина, LILDRUGHILL, Aarne, YUNGWAY, rizza, uglystephan, nkeeei, Toxi$"
MACAN,"JAMIK, Kambulat, WHITE GALLOWS, Jakone, By Индия, РУВИ, Santiz, Канги, ФОГЕЛЬ, LUCAVEROS, 10AGE, Пабло, A.V.G, Mr Lambo, Xassa, TEKSIDR, Andy Panda, ""Ramil"", SHAMI, Вектор А"
kizaru,"Yanix, THRILL PILL, OBLADAET, JEEMBO, Big Baby Tape, PHARAOH, FACE, Mnogoznaal, LIZER, Husky, Skryptonite, Markul, Thomas Mraz, White Punk, LSP, Truwer, 044 ROSE, ATL, Mosquit, T-Fest"
Кишлак,"Автостопом по фазе сна, семьсот семь, курящих нет, Я.СГОРЕЛ.ДВАЖДЫ, Солнечный Муслим, КАКАЯ РАЗНИЦА, БРЕДИШЬ, Синдром Восьмиклассника, конец солнечных дней, вышел покурить, Джизус, gitarakuru, rizza, whyalive, не панк, LIL MORFY, СЕРЕГА ПИРАТ, Cold Carti, quiizzzmeow, Sqwore"
Toxi$,"SixteenInMono, Ferdk, Shady Cicada, Dinnick the 3rd, Artificial Fear, Husky by the Geek, Vomitron, Nestalgica, Daniel Tidwell, GlitchxCity, Powerglove, Game & Sound, Ro Panuganti, Megadriver, Year 200X, Neku, Thunderclash, Retro Remix Revue, Sean Schafianski, GaMetal"
Шайни,"MBLAQ, 2PM, TEEN TOP, SUPER JUNIOR, G-DRAGON, TVXQ!, f(x), FTISLAND, U-KISS, B1A4, CNBLUE, 2NE1, Beast, miss A, BTOB, SHINHWA, SS501, ""NUEST"", SISTAR, Wonder Girls"
(G)I-DLE,"Hwa Sa, TWICE, LOONA, MAMAMOO, Weki Meki, SEULGI, WJSN, JEON SOYEON, fromis_9, K/DA, MOMOLAND, OH MY GIRL, BLACKPINK, Red Velvet, LOOΠΔ / ODD EYE CIRCLE, I.O.I, CLC, PRISTIN V, HYOLYN, CHUNG HA"
INTERWORLD,"ONIMXRU, Xantesha, MC ORSEN, chipbagov, SCXR SOUL, VØJ, Hensonn, fam0uz, KUTE, Pluxry SkUrt, SHADXWBXRN, Ariis, Isolate.exe, GLWKMOD, STXRZ, PLAYAMANE, SHPACKYOU$, ZODIVK, Phonkha, MoonDeity"
Kill Eva,"ENCASSATOR, madk1d, билборды, whyalive, rizza, kawaiianimegirlll1337, gitarakuru, курящих нет, влад пиво, zeekayo, СЕРЕГА ПИРАТ, Sqwore, КАКАЯ РАЗНИЦА, zxcursed, конец солнечных дней, ANGUISH, kantaa, 17 SEVENTEEN, Xdree, Midix"
Quest Pistols,"Vera Brezhneva, Gradusy, Nikita, PIZZA, Sergey Lazarev, VIA Gra, Vintage, ""BandEros"", Bianka, LOBODA, Hi-Fi, IOWA, REFLEX, Propaganda, Verka Serduchka, Nyusha, Korni, Elvira T, Diskoteka Avariya, Glukoza"
Три дня дождя,"тринадцать карат, MUKKA, saypink!, DSPRITE, pyrokinesis, наше последнее лето, КОСМОНАВТОВ НЕТ, курящих нет, пачкасигарет, Aikko, Naitivihod, Джизус, Cold Carti, билборды, Я.СГОРЕЛ.ДВАЖДЫ, playingtheangel, семьсот семь, Папин Олимпос, fem.love, БРЕДИШЬ"
Skryptonite,"ATL, LSP, Thomas Mraz, Truwer, Yanix, T-Fest, OBLADAET, kizaru, Husky, Markul, FACE, Pika, Mnogoznaal, V $ X V PRiNCE, Max Korzh, JEEMBO, Big Baby Tape, Oxxxymiron, JILLZAY, PHARAOH"
Korol i Shut,"Lumen, Pornofilmy, Priklyucheniya Elektronikov, Kukryniksy, Горшок, KnyaZz, Aria, Agatha Christie, Piknik, Brutto, Egor Letov, ДДТ, Tarakany!, Louna, Chaif, Kino, Animal Jazz, Krematorij, Bravo, Кипелов"
Pepel Nahudi,"NEWLIGHTCHILD, KVESTAR, Минин, whyalive, lil 17th, nkeeei, LXNER, Шайни, rizza, SEEYASIDE, Кореш, kantaa, zeekayo, PINQ, 44neverluv, 3TERNITY, Sqwore, Toxi$, Daybe, Cold Carti"
Scally Milano,"uglystephan, 163ONMYNECK, Шайни, PLOHOYPAREN, BUSHIDO ZHO, LIL MORTY, Heronwater, LOVV66, OG Buda, MAYOT, Платина, SODA LUV, Yanix, YUNGWAY, ROCKET, LIL KRYSTALLL, PINQ, August, Aarne, xxxmanera, "
ooes,"zhanulka, Я.СГОРЕЛ.ДВАЖДЫ, курящих нет, Папин Олимпос, Автостопом по фазе сна, ПОЛМАТЕРИ, Cold Carti, Vspak, ssshhhiiittt!, Дайте танк (!), вышел покурить, ЩЕНКИ, pyrokinesis, алёна швец., Кишлак, КОСМОНАВТОВ НЕТ, конец солнечных дней, Poshlaya Molly, нексюша, Monetochka"
INSTASAMKA,"Yanix, LOVV66, daryana, SODA LUV, Big Baby Tape, Aarne, Scally Milano, LSP, Poshlaya Molly, V $ X V PRiNCE, GONE.Fludd, TATISIZE, Дора, FACE, MAYBE BABY, OG Buda, uglystephan, kizaru, BUSHIDO ZHO, Платина"
