Artist,Related Artists
ROSALÍA,"Mala Rodríguez, DELLAFUENTE, C. Tangana, Paloma Mami, Bad Gyal, Ms Nina, NATHY PELUSO, Cruz Cafuné, La Zowi, Polimá Westcoast, Lele Pons, Maikel Delacalle, Tomasa del Real, Yung Beef, Alvaro Diaz, Omar Montes, BEA PELEA, Chocolate Remix, Talisto, Cazzu"
Brray,"Joyce Santana, Rafa Pabön, Joniel, Menor Menor, Pacho El Antifeka, Gigolo Y La Exce, Juanka, Lil Geniuz, Pj Sin Suela, Lyanno, Sou El Flotador, Young Martino, Pusho, Jamby El Favo, Super Yei, Trap Capos, Chris Wandell, Dayme y El High, Jay Menez, Andre TG"
Kapla y Miky,"Arjan, García, Ancizar, Daniel Merak, Mario Puglia, Jordy Jill, Legarda, Dennis Fernando, Juan Morelli, Nabález, Bomby, Coko Torres, Felipe Ospina, Estereobeat, Altafulla, Tres Dedos, Itzza Primera, XAXO, Dimelo Sam, Yera"
Mora,"Saiko, Alvaro Diaz, Tainy, Alejo, Jhayco, Lyanno, Alex Rose, Lunay, Brytiago, Maikel Delacalle, Polimá Westcoast, Rich Music LTD, Papi Sousa, Javiielo, Funzo & Baby Loud, Amenazzy, Eladio Carrion, Nio Garcia, Jay Wheeler, Chris Jedi"
Arcángel,"De La Ghetto, Ñejo, Jowell & Randy, Zion, Cosculluela, Alexis y Fido, Trebol Clan, Tony Dize, Tego Calderón, Dalmata, Zion & Lennox, Baby Rasta & Gringo, Wisin, J Alvarez, Nicky Jam, DJ Nelson, Farruko, Luny Tunes, Yandel, Casa De Leones"
Tony Dize,"Trebol Clan, Zion, Alexis y Fido, Magnate Y Valentino, De La Ghetto, Dalmata, Casa De Leones, Jowell & Randy, Zion & Lennox, Luny Tunes, Eddie Dee, Tego Calderón, Magnate, Jadiel, Ivy Queen, Wisin, Divino, Tito ""El Bambino"", DJ Nelson, Baby Rasta & Gringo, ""Error occurred while searching for the artist Blessd. Status code: 429"", ""Error occurred while searching for the artist Tego Calderón. Status code: 429"", ""Error occurred while searching for the artist Nicky Jam. Status code: 429"", ""Error occurred while searching for the artist Fresto Music. Status code: 429"", ""Error occurred while searching for the artist Fuerza Regida. Status code: 429"", ""Error occurred while searching for the artist Ryan Castro. Status code: 429"", ""Error occurred while searching for the artist Saiko. Status code: 429"", ""Error occurred while searching for the artist J Balvin. Status code: 429"", ""Error occurred while searching for the artist Grupo Niche. Status code: 429"", ""Error occurred while searching for the artist Gobs. Status code: 429"", ""Error occurred while searching for the artist Ukendt Kunstner. Status code: 429"", ""Error occurred while searching for the artist D1MA. Status code: 429"", ""Error occurred while searching for the artist Tobias Rahim. Status code: 429"", ""Error occurred while searching for the artist Justin Bieber. Status code: 429"", ""Error fetching related artists for Ida Laurberg. Status code: 429"", ""Error occurred while searching for the artist ICEKIID. Status code: 429"", ""Error occurred while searching for the artist Lamin. Status code: 429"", ""Error occurred while searching for the artist Benny Jamz. Status code: 429"", ""Error occurred while searching for the artist TopGunn. Status code: 429"", ""Error occurred while searching for the artist andreas odbjerg. Status code: 429"", ""Error occurred while searching for the artist Artigeardit. Status code: 429"", ""Error occurred while searching for the artist Danser Med Piger. Status code: 429"", ""Error fetching related artists for Caroline Dubois. Status code: 429"", ""Error occurred while searching for the artist Christopher. Status code: 429"", ""Error occurred while searching for the artist Tessa. Status code: 429"", ""Error occurred while searching for the artist URO. Status code: 429"", ""Error occurred while searching for the artist Skinz. Status code: 429"", ""Error occurred while searching for the artist Gilli. Status code: 429"", ""Error occurred while searching for the artist Zara Larsson. Status code: 429"", ""Error occurred while searching for the artist Toko. Status code: 429"", ""Error occurred while searching for the artist Blæst. Status code: 429"", ""Error occurred while searching for the artist Saint clara. Status code: 429"", ""Error fetching related artists for KESI. Status code: 429"", ""Error occurred while searching for the artist J Luminari. Status code: 429"", ""Error fetching related artists for Jey One. Status code: 429"", ""Error occurred while searching for the artist Donaty. Status code: 429"", ""Error occurred while searching for the artist Dj Adoni. Status code: 429"", ""Error occurred while searching for the artist El Alfa. Status code: 429"""
Anuel AA,"Nio Garcia, Rvssian, Brytiago, Bryant Myers, Jhayco, Chris Jedi, Jon Z, Myke Towers, Lunay, Mau y Ricky, Lary Over, Tainy, KEVIN ROLDAN, Amenazzy, DJ Luian, Sech, Ozuna, Cazzu, Ñengo Flow, Jory Boy"
DJ PEREIRA,
Yaisel LM,"Donaty, Kaly Ocho, Jezzy, EL YALA, Chocoleyrol, Yomel El Meloso, Papaa Tyga, Martin Lora, Tivi Gunz, Dilon Baby, Alex Roxario, Eklectico, Flow 28, Kiry Curu, Cifra Slimk, Treintisiete, Leo RD, Onguito Wa, T.Y.S, Llego la connect"
Jezzy,"Papaa Tyga, Yaisel LM, Martin Lora, Donaty, Eklectico, Dilon Baby, Tivi Gunz, EL YALA, Chocoleyrol, Alex Roxario, Kaly Ocho, Kiry Curu, Cifra Slimk, T.Y.S, Llego la connect, Jey One, MC Albertico, Flow 28, Yomel El Meloso, TRAMPA BILLONE"
Jay Wheeler,"Lyanno, Dímelo Flow, Javiielo, Alejo, Chris Lebron, Dimelo Siru, Beéle, Gigolo Y La Exce, Juhn, Noriel, Lenny Tavárez, Papi Sousa, DEKKO, Lunay, Omy de Oro, Casper Magico, Ovy On The Drums, Amenazzy, Brytiago, Miky Woodz"
Chimbala,"Secreto ""El Famoso Biberon"", El Shick, El Chuape, El Batallon, El Alfa, Black Jonas Point, Pablo Piddy, Crazy Design, Mozart La Para, La Insuperable, Monkey Black, Shelow Shaq, Jacool, Joa El Super MC, Bulin 47, Shadow Blow, Poeta Callejero, Don Miguelo, Banda Real, Ceky Viciny"
Ñengo Flow,"Jory Boy, Lary Over, Bryant Myers, Brytiago, Noriel, Miky Woodz, Chris Jedi, Luigi 21 Plus, Ñejo, Casper Magico, Gotay ""El Autentiko"", Nova y Jory, Cosculluela, De La Ghetto, Yampi, Randy, Ñejo & Dalmata, KEVIN ROLDAN, Revol, Jowell & Randy"
Abd El Basset Hamouda,"Abdelbaset Hamouda, Ahmed Adaweya, Reda El Bahrawy, Ahmed Sheba, Mahmoud El Leithy, Tarek El Sheikh, Hassan El Asmar, Shafeqa, Ahmed Amer, Medhat Saleh, Omar Kamal, Double Zuksh, Muslim, Seif Magdy, Abdelbaset Hamooda, عمرو السعيد, Sadat, Resha Costa, Moustafa Hagag, G. Oka"
Ahmed Saad,"Haytham Shaker, Khaled Selim, Amer Mounib, Mohamed Mohie, Loai, Hamada Helal, Mohamed Nour, Ramy Gamal, Abou Elleef, Bahaa Sultan, Ramy Sabry, Hany Shaker, Medhat Saleh, Mohamed Fouad, Angham, Mohamed Hamaki, Mahmoud El Esseily, Tamer Ashour, Ehab Tawfik, Amr Mostafa"
Nawal,"Amal Hijazi, Maya Nasri, Najwa Karam, Carole Samaha, Iwan, Fadel Chaker, Samira Said, Elissa, Myriam Fares, Latifa, Marwan Khoury, Wael Kfoury, Hisham Abbas, Haifa Wehbe, Melhem Zein, Jannat, Ramy Ayach, Angham, Julia Boutros, Ragheb Alama"
Essam Sasa,"Hamo ElTikha, حمو الطيخا, Ahmed Moza, Karim Cristiano, Hamo Bika, Hoda Bondok, Ameen Khattab, 3enba, 7l2olo, El Mahrgan, Reda El Bahrawy, FL EX, Mody Amin, Muslim, Ahmed Kamel, Seif Magdy, Resha Costa, Husayn, مسلم, Wingii"
Mohammed Saeed,"Ahmed Kamel, Muslim - مُسلِم, Ghaliaa, Lege-Cy, Shehab, Mahmoud El Esseily, Shahyn, Abo El Anwar, Massar Egbari, Tamer Ashour, Bahaa Sultan, Ramy Gamal, Bigsam, A5rass - الاخرس, Ramy Sabry, Muhab, Adham Seliman, Afroto, El Joker, El Waili"
Mohamed Ramadan,"Oka Wi Ortega, Moustafa Hagag, El Sawareekh, Sharmoofers, Hassan Shakosh, Akram Hosny, Omar Kamal, Ruby, Sadat, نور النبوي, 3enba, Hakim, Mahmoud El Esseily, Ahmed Bahaa, Mahmoud El Leithy, Ahmed Saad, Hamo Bika, Muslim, Hamada Helal, Hoda Bondok"
Karim Cristiano,"Ahmed Moza, 7l2olo, Ameen Khattab, Mody Amin, Ali Adora, Resha Costa, Omar Id, Hamo ElTikha, حمو الطيخا, Hamo Bika, Hoda Bondok, محمد سلطان, Mostafa el Degwy, Seif Magdy, Hoda Nasser, El Mahrgan, Felo, Ahmed Amer, مسلم, Reda El Bahrawy, "
Bahaa Sultan,"Karim Mohsen, Medhat Saleh, Ramy Gamal, Mahmoud El Esseily, Ahmed Mekky, Amal Maher, Angham, Ramy Sabry, Mohamed Fouad, Mohamed Mounir, Mohamed Mohie, Mohamed Hamaki, Haytham Shaker, Loai, Amr Mostafa, Khaled Selim, Tamer Ashour, Hamza Namira, Abou Elleef, Hossam Habib"
Ramy Sabry,"Mohamed Fouad, Hossam Habib, Jannat, Tamer Ashour, Angham, Wael Jassar, Mohamed Hamaki, Amr Mostafa, Fadel Chaker, Tamer Hosny, Loai, Mohamed Mounir, Elissa, Bahaa Sultan, Karim Mohsen, Amr Diab, Hisham Abbas, Samira Said, Myriam Fares, Carole Samaha"
Wegz,"Lege-Cy, Abo El Anwar, Marwan Pablo, Marwan Moussa, Afroto, Abyusif, Shahyn, El Waili, Shehab, Molotof, Husayn, Mousv, Muhab, Wingii, FL EX, Moscow, Double Zuksh, DizzyTooSkinny, ZIAD ZAZA, Sharmoofers"
Double Zuksh,"Wezza Montaser, Moscow, DJ Totti, Arsenik, Batistuta, Slyver PV, Molotof, Sadat, Ahmed Santa, Lil Baba, Intomymind, Wingii, Shehab, Shahyn, El Waili, Eldab3, Abo El Anwar, DizzyTooSkinny, ZIAD ZAZA, 3enba"
Maha Ftouni,"Ahmed Batshan, Houda Bondok, Ramy Gamal, Wael Jassar, Ramy Sabry, Tamer Ashour, Muhab, Muslim - مُسلِم, Ahmed Kamel, El Mahrgan, Mohammed Saeed, Bahaa Sultan, Hoda Bondok, Hamo Bika, Assala Nasri, Angham, Hamo ElTikha, Afroto, 7l2olo, Sherine"
Muslim,"Ahmed Kamel, Mohammed Saeed, Tamer Ashour, Bahaa Sultan, 3enba, Afroto, Lege-Cy, Adham Seliman, Muhab, Ramy Gamal, Abo El Anwar, Shehab, FL EX, Shahyn, Ramy Sabry, Ghaliaa, Mahmoud El Esseily, Maha Ftouni, El Joker, Hoda Bondok"
Reda El Bahrawy,"Ahmed Sheba, Ahmed Amer, Resha Costa, Ali Adora, Seif Magdy, محمد سلطان, Ahmed Moza, Hoda Bondok, Ameen Khattab, Tarek El Sheikh, Muslim, مسلم, Mostafa el Degwy, Mody Amin, 7l2olo, Ahmed Abdo, Felo, رمضان البرنس, Mahmoud El Leithy, Hamo Bika"
Sharmoofers,"Mahmoud El Esseily, Ahmed Mekky, Massar Egbari, Moustafa Hagag, Bahaa Sultan, Mohamed Mounir, Cairokee, Ramy Gamal, Donia Samir Ghanem, Amr Mostafa, Aida el Ayoubi, Hamza Namira, Angham, Carmen Soliman, Dina El Wedidi, Ramy Sabry, Medhat Saleh, Amer Mounib, Mohamed Fouad, Aziz Maraka"
Muslim - مُسلِم,"Ahmed Kamel, Mohammed Saeed, Tamer Ashour, Bahaa Sultan, 3enba, Afroto, Lege-Cy, Adham Seliman, Muhab, Ramy Gamal, Abo El Anwar, Shehab, FL EX, Shahyn, Ramy Sabry, Ghaliaa, Mahmoud El Esseily, Maha Ftouni, El Joker, Hoda Bondok"
Farid,"Agnee, Advaita, Swarathma, Papon, Sifar, Blackstratblues, Tajdar Junaid, Indian Ocean, Ankur Tewari, Parvaaz, Silk Route, Kaash, Parikrama, Sona Mohapatra, Motherjane, Ram Sampath, Strings, Farhan Akhtar, Mrigya, Lucky Ali"
Cairokee,"Hamza Namira, Mohamed Mounir, Ahmed Mekky, Sharmoofers, Massar Egbari, Bahaa Sultan, Mahmoud El Esseily, El Morabba3, Ramy Sabry, Omar Khairat, Ahmed Adaweya, Donia Samir Ghanem, Mohamed Hamaki, Angham, Mohamed Fouad, Ramy Gamal, Aida el Ayoubi, Medhat Saleh, Aziz Maraka, Hossam Habib"
Amir Eid,"ريفو شو, Massar Egbari, Galaleo, Zap Tharwat, Aziz Maraka, Sharmoofers, Donia Wael, Ghaliaa, Dina El Wedidi, Aida el Ayoubi, El Waili, Shahyn, Yonyo, Lege-Cy, Mahmoud El Esseily, Cairokee, El Joker, Muhab, Hamza Namira, Ali Loka, ""Error occurred while searching for the artist Wingii. Status code: 429"", ""Error occurred while searching for the artist Marwan Pablo. Status code: 429"", ""Error occurred while searching for the artist Wael Jassar. Status code: 429"", ""Error occurred while searching for the artist Afroto. Status code: 429"", ""Error occurred while searching for the artist Karim Osama. Status code: 429"", ""Error occurred while searching for the artist Tamer Hosny. Status code: 429"", ""Error occurred while searching for the artist Abo El Anwar. Status code: 429"", ""Error occurred while searching for the artist Samar Tarik. Status code: 429"", ""Error occurred while searching for the artist Mohamed Mounir. Status code: 429"", ""Error occurred while searching for the artist 3enba. Status code: 429"", ""Error occurred while searching for the artist FL EX. Status code: 429"", ""Error occurred while searching for the artist ريفو شو. Status code: 429"", ""Error occurred while searching for the artist Ahmed Kamel. Status code: 429"", ""Error occurred while searching for the artist Eldab3. Status code: 429"", ""Error occurred while searching for the artist Muhab. Status code: 429"", ""Error occurred while searching for the artist ibe. Status code: 429"", ""Error occurred while searching for the artist SHRTY. Status code: 429"", ""Error occurred while searching for the artist Käärijä. Status code: 429"", ""Error occurred while searching for the artist Gettomasa. Status code: 429"", ""Error occurred while searching for the artist Costi. Status code: 429"", ""Error occurred while searching for the artist Isac Elliot. Status code: 429"", ""Error occurred while searching for the artist BEHM. Status code: 429"""
Korelon,"Jami Faltin, VJ, KERZA, Jore & Zpoppa, Blacflaco, Turisti, Nebi, ST, Madboiali, DAVI, SHRTY, vitunleija, Ege Zulu, william, LAVAREDO, Joe L, Ares, Bizi, Ray G, Fabe"
JVG,"Lyn Lapid, Devin Kennedy, Suriel Hess, vaultboy, dhruv, elijah woods, demxntia, Chris James, Claire Rosinkranz, John Michael Howell, Rocco, Stephen Dawes, Ruel, Luke Chiang, sammy rash, grentperez, Takayoshi, MAX, brb., Stephen Sanchez"
KUUMAA,"SINI YASEMIN, Nelli Matula, Keko Salata, Tuure Boelius, costee, YOUNGHEARTED, Vilma Alina, Mikko Harju, Intiaanikesä, Aleksanteri Hakaniemi, DJ Oku Luukkainen, Roope Salminen & Koirat, Erika Vikman, Ida Paul & Kalle Lindroth, Tuure Kilpeläinen ja Kaihon Karavaani, BESS, Lukas Leon, Adi L Hasla, Elias Kaskinen, Mouhous"
Aste,"d3r, wujek, xofilo, vanity, m1v, cholorofilm, m0v, syris, w6lker, 1stress, LyteSpeed, Kaneda7, Feeluvsyou, luvwillow, threedimensionsapart, KidSnorlax, korpsebunny, Lei, Vampyx, heroinsick"
Överi,"The Blasting Company, Louie Zong, The Scary Jokes, The Altogether, Cosmo Sheldrake, Jack Conte, Miracle Musical, Adventure Time, Sterling K. Brown, Petrojvic Blasting Company, Austin Weber, Brian David Gilbert, The Crane Wives, Alec Holowka, Shayfer James, Fish in a Birdcage, Will Wood and the Tapeworms, Worthikids, Will Wood, Zach Callison"
Evelina,"Margith Mathiesen, Emma Moore, Veronica Lindlom, Tristan Hertzog, Liddy Hall, Joanna Carlton, Joey Ty, Bente Schultz, Roly Lucian, Verna Fuller, Kayden Roydon, ""Fiona OHara"", Myrna Maguire, Beverly Eldon, Fifine Lambert, Hyrum Spears, Miki Broberg, Tatton Sage, Rhett Seabrooke, Gerjanne van Hooft"
BESS,"Fenne Lily, Samantha Crain, Eleni Drake, Anna Leone, Uma, This Is The Kit, Skullcrusher, Brooke Bentham, Abby Sage, Hand Habits, Maple Glider, Marika Hackman, Katy Kirby, Katy J Pearson, Matilda Mann, Gia Margaret, Flyte, Orlando Weeks, Lomelda, Billie Marten"
Blacflaco,"KERZA, Madboiali, VJ, Nuteh Jonez, Jore & Zpoppa, DAVI, ST, SHRTY, Jami Faltin, Turisti, Ares, vitunleija, Korelon, BADU, LAVAREDO, Fabe, Bizi, Nebi, william, Joe L"
Robin Packalen,"Mikael Gabriel, TUULI, Evelina, SANNI, Nikke Ankara, Benjamin, VIIVI, Nelli Matula, ABREU, Elastinen, Ellinoora, Tuure Boelius, Ollie, Pikku G, Cheek, Jenni Vartiainen, Etta, Roope Salminen & Koirat, Pihlaja, Aste"
VJ,"OnlyDestroyLonely, Joe Worker, dyingoutlay, Keltechh, Ifys, t5xy, fortune, FuckMant, jahhde, Rick Owens, 0oDarksideo0, Indigo, dru, Drkshdw, Destroying Lonely, paxed, wound, purzs, Destroyed Lonely, Izaya Tiji Archive"
Fabe,"Sonder, Chase Shakur, Avenoir, FrOc, Sellhis, blondead, Essosa, Baby Smoove, Zach Templar, Brent Faiyaz, Heavy Weight, Autumn!, Ryan Trey, Eem Triplin, int, Bryson Tiller, Faye Webster, PARTYNEXTDOOR, Jordan Ward, MAVI"
VIIVI,
Cledos,"ibe, Axel Kala, Lyttä, Mouhous, Cavallini & Shrty, costee, MKDMSK, OG Ulla-Maija, Adi L Hasla, Sliki, Olli Antonio, NCO, AHTI, Turisti, Joe L, Lukas Leon, Bizi, Fabe, william, Nebi"
Alessandra,"Subwoolfer, Maria Celin, Skrellex, BLANKA, Jasmin Rose, KEiiNO, Mae Muller, ELLA A, Ulrikke, TuralTuranX, Albina dhe familja Kelmendi, Keira, ALIKA, Vesna, Tiril, Cornelia Jakobs, Käärijä, Andrew Lambrou, Loreen, Joker Out"
Bee,"Andy Gibb, Leo Sayer, Barry Manilow, Gloria Gaynor, Olivia Newton-John, Chicago, Carpenters, ""Gilbert OSullivan"", KC & The Sunshine Band, Village People, Bread, Donna Summer, Christopher Cross, Lobo, Neil Diamond, Kool & The Gang, Air Supply, Dr. Hook, Frankie Valli, Boney M."
Portion Boys,"Nikke Ankara, Evelina, Spekti, Ellinoora, Petri Nygård, Poju, Teflon Brothers, Arttu Wiskari, Antti Tuisku, Elastinen, Mikael Gabriel, JVG, Pikku G, Gettomasa, Cheek, Kaija Koo, Pasi ja Anssi, Lord Est, Isac Elliot, Yksi Totuus, "
Pasi ja Anssi,"HesaÄijä, Yksi Totuus, Mansesteri, BESS, Adi L Hasla, Mäkki, Herrat, Pää-äijät, Lukas Leon, RosvoSektori, OG Ulla-Maija, Mouhous, Roope Salminen & Koirat, ILARI, MKDMSK, Profeetat, Ed Caspian, Kerava, RANKKALINNA, Keko Salata"
TUULI,"Fabe, Joe L, Etta, vitunleija, Turisti, SHRTY, william, Pihlaja, Phimi, AHTI, LAVAREDO, ANI, Ares, Bämä, Tuure Boelius, DAVI, El Migu, Nebi, Blacflaco, Jami Faltin"
Ramses II,"Jenni & Juho, HesaÄijä, ""90s FIN Cover Boyz & Girlz!"", Kehä, Faija, Yksi Totuus, Kuningas Pähkinä & Setä Tamu, DJ Oku Luukkainen, Retropop, Pasi ja Anssi, Rasmus Gozzi Finland, Eini, Hausmylly, Chorale, Roope Salminen & Koirat, Juhana Haukkala, Herrat, Dilemma, Erika Vikman, Millennium Project"
ABREU,"Katri Ylander, Irina, Kaija Koo, Antti Tuisku, Haloo Helsinki!, Laura Närhi, Kristiina Brask, Tiktak, Johanna Kurkela, Teleks, Nylon Beat, Happoradio, Suvi Teräsniska, Pete Parkkonen, Arttu Wiskari, Gimmel, Erin, Jenni Vartiainen, Pikku G, Juha Tapio"
Haloo Helsinki!,"Irina, Kaija Koo, ABREU, Antti Tuisku, Laura Närhi, Happoradio, Jenni Vartiainen, Chisu, Katri Ylander, Johanna Kurkela, Juha Tapio, Arttu Wiskari, Tiktak, PMMP, Anssi Kela, Maija Vilkkumaa, Erin, Teleks, Suvi Teräsniska, Mikael Gabriel"
BLANKA,"Viki Gabor, Daria Marx, Team X, Cleo, Julia Żugaj, Roxie Węgiel, Sara James, bryska, GENZIE, Palion, Doda, Dominik Rupiński, Roksana Węgiel, Olivia Addams, Mako, Małe TGD, Izabela Kisio Skorupa, Margaret, Alessandra, Audiosoulz"
Pihlaja,"Ida Paul & Kalle Lindroth, costee, Tuure Boelius, Elias Kaskinen, SINI YASEMIN, Nelli Matula, ANI, Adi L Hasla, BESS, Etta, Heviteemu, ABREU, Ollie, WIL, Evelina, Vilma Alina, Miika, Bee, Lore, Aste"
Benjamin,"Mitch Wong, JUDAH., LO Worship, 7 Hills Worship, Tekoa, Joshua Leventhal, Erik Nieder, Anna Golden, Harvest, Patrick Mayberry, Josh Baldwin, Abbie Gamboa, Amanda Cook, Ethan C. Davis, Jervis Campbell, Jeremy Riddle, Gable Price and Friends, Bryan McCleery, Ryan Ellis, Ben Potter"
Heuss L,"GLK, YL, Maes, DA Uzi, Bramsito, Kalash Criminel, Hornet La Frappe, 13 Block, Timal, Gradur, MMZ, ""LAllemand"", SCH, Niska, Sadek, Soolking, Mister You, Moha La Squale, ""RimK"", Landy"
Werenoi,"Mig, Zkr, Fresh La Douille, Niaks, Gambino La MG, UZI, Timal, Zed, Hös Copperfield, Dwen, Landy, DA Uzi, SDM, Leto, L2B, Hornet La Frappe, Sasso, Pirate, Mister You, Niro"
PLK,"OBOY, Caballero & JeanJass, Sneazzy, Doums, Lorenzo, Dinos, Mister V, Leto, Zamdane, Josman, Dosseh, Hornet La Frappe, Laylow, MZ, Green Montana, Lefa, S-Crew, Kekra, Hamza, Bekar"
Vacra,"Low Jay, MadeInParis, Monsieur Nov, Harley, Warren Saada, Youka, ""Saysz"", mademoiselle lou, Maïssa, JEY BROWNIE, Lala &ce, Smeels, YG Pablo, Genezio, Ronisia, Kim, HD La Relève, Prinzly, Shay, Nemir"
NAZAKEBLACK,"King Serenity, DJ Vielo, DJ Bens, Dj Leska, Mortalla, Naza, Gambino, Fresh, Bolémvn, Hornet La Frappe, Benab, No Limit, RK, Alonzo, KeBlack, Landy, GLK, Gambi, Gradur, Harley"
GAULOIS,"Kaneki, Lamatrix, Hös Copperfield, SLK, Elh Kmer, Yaro, Gianni, Bilton, SAF, Bramsito, Liim’s, Waïv, UZI, Bolémvn, Oskoow, Genezio, Graya, L2B, L’As, Dabs"
Nuit Incolore,"Izumø, Yuston XIII, Chiloo, Shikki, Pxrselow, Princesse, SPECY MEN, Cikey, Petit Voyou, Eta, ""BlamS"", Dorely, Yonis, GS, Carbonne, Fredz, Seizur, Hipo, Younsss, IZAID"
Favé,"Gyakie, Majeeed, Magixx, Cheque, Chike, ""Nikita Kering"", Boy Spyce, Johnny Drille, Khaid, Crayon, Simi, Iyanya, LADIPOE, Ajebo Hustlers, DJ Neptune, Spyro, Bad Boy Timz, Skiibii, Mayorkun, Camidoh"
Djadja & Dinaz,"Brulux, Benab, Bolémvn, Kofs, Mehdi Yz, Pins & Dimeh, Soso Maness, L2B, F430, ZeGuerre, Kamikaz, Key Largo, AM La Scampia, Timal, Hornet La Frappe, RK, Sasso, Landy, Anas, UZI"
Hamza,"Kekra, Josman, ""Jokair"", 13 Block, Zamdane, Kalash Criminel, Dinos, Laylow, Freeze corleone, OBOY, Doums, Caballero & JeanJass, Zola, Krisy, 404Billy, Alpha Wann, DA Uzi, Sneazzy, Jazzy Bazz, Zuukou mayzie"
Nahir,"Lazer MMZ, SLK, Frenetik, Zikxo, Rvzmo, Norsacce Berlusconi, Sadek, L’As, Rimkus, Elh Kmer, Hös Copperfield, Jnr Slice, GLK, Kore, La F, ISK, UZI, Carbozo, YL, MALTY 2BZ"
Aden Foyer,"Jonas Aden, Mesto, Vluarr, Seth Hills, Blinders, Slopes, Brooks, Julian Jordan, Victoria Nadine, Jay Eskar, Justin Mylo, NUZB, RetroVision, Siik, Mo Falk, TV Noise, Synne Vo, Oven, Aspyer, Ruben"
Jul,"Snail Mail, boygenius, Tomberlin, Lucy Dacus, Better Oblivion Community Center, Haley Heynderickx, Soccer Mommy, Lomelda, Big Thief, Julia Jacklin, Lady Lamb, The Beths, Sharon Van Etten, Caroline Rose, Claud, Japanese Breakfast, Miya Folick, Christian Lee Hutson, Liza Anne, Waxahatchee"
Gazo,"Leto, Green Montana, Kerchak, Koba LaD, Guy2Bezbar, DA Uzi, OBOY, Fresh, Kaza, Bolémvn, Tiakola, Landy, Favé, Zed, Gambino La MG, Dosseh, 1PLIKÉ140, Mig, RK, Rsko"
Zola,"DA Uzi, Hamza, ""Jokair"", Josman, 13 Block, Kalash Criminel, Kekra, Laylow, PRIME, Niska, 4Keus, Moha La Squale, Dinos, Maes, Damso, Lorenzo, Luidji, PNL, GLK, OBOY"
Becky G,"Sofía Reyes, Lele Pons, Mario Bautista, CNCO, Nacho, NATTI NATASHA, Greeicy, Mau y Ricky, Abraham Mateo, Danna Paola, Wisin, Lunay, Zion & Lennox, Ingratax, Ovy On The Drums, Guaynaa, Justin Quiles, Nicky Jam, Ivy Queen, Paty Cantú"
Dau,"Default, 3 Doors Down, Hinder, Shinedown, Theory of a Deadman, Fuel, Saving Abel, Crossfade, Sick Puppies, Lifehouse, 12 Stones, Seether, Scott Stapp, Nickelback, The Calling, My Darkest Days, Trapt, David Cook, Creed, Red, ""Error fetching related artists for R3HAB. Status code: 429"", ""Error occurred while searching for the artist Sound Of Legend. Status code: 429"", ""Error fetching related artists for Apache 207. Status code: 429"", ""Error occurred while searching for the artist Jamal. Status code: 429"", ""Error occurred while searching for the artist Ikke Hüftgold. Status code: 429"""
FiNCH,"Matchbook Romance, Funeral For A Friend, Armor For Sleep, Senses Fail, Thursday, A Static Lullaby, Boys Night Out, Saosin, From First To Last, From Autumn To Ashes, Scary Kids Scaring Kids, Dead Poetic, Hawthorne Heights, Story Of The Year, Hidden In Plain View, Aiden, Alexisonfire, The Used, Head Automatica, Emery"
Peter Fox,"Fettes Brot, Clueso, Jan Delay, Seeed, Deichkind, Culcha Candela, SDP, Beginner, Die Fantastischen Vier, Sportfreunde Stiller, Marteria, Kraftklub, K.I.Z, Madsen, Max Herre, Blumentopf, Samy Deluxe, Beatsteaks, 257ers, Irie Révoltés"
HoodBlaq,"Jamal, Bobby Vandamme, Koushino, Soufian, D1NO, O.G., OMAR, KARDO, Saha Saha, Dorian, Camaeleon, Silva, MADE, AK 33, OG LOCKE, NGEE, SIL3A, Undacava, Musso, YAKARY"
Pashanim,"Symba, Dante YN, Endzone, Lucio101, Beyazz, TM, pasha archive, BHZ, Rosc, Sampagne, Ion Miles, OMG, Ocboyblau, $OHO BANI, Nizi19, makko, KASIMIR1441, Longus Mongus, Lugatti & 9ine, Yung Hurn"
Tream,"MartinBepunkt, LUZI, Stefan Stürmer, Isi Glück, HBz, Honk!, Die Atzen, Julian Sommer, Luca-Dante Spadafora, Nils_Gucki, Schmitty Extreme, Julian Benz, Kreisligalegende, Ikke Hüftgold, Lorenz Büffel, Mia Julia, Pazoo, Darius & Finlay, Harris & Ford, Tobee"
Azet,"Zuna, Azzi Memo, Miami Yacine, Nash, Kurdo, ""Rais"", Eno, NGEE, Capo, Kalazh44, Mert, Belah, BOJAN, Veysel, Undacava, EREN CAN, OMAR, Ardian Bujupi, O.G., Anonym"
Olexesh,"Azzi Memo, Miami Yacine, Majoe, PA Sports, Mert, Hanybal, King Khalil, Zuna, Dardan, Sun Diego, Celo & Abdi, Haze, Nash, Jigzaw, Kurdo, XATAR, Veysel, GRiNGO, Nate57, KALIM"
Hava,"Joseph Banowetz, Benjamin Frith, Bertrand Chamayou, Ashley Wass, Evgeny Zarafiants, Michael Endres, Alexander Paley, Lazar Berman, Ulster Orchestra, Seattle Symphony Orchestra, Maria Lettberg, Leif Ove Andsnes, André Laplante, Konstantin Scherbakov, Daniil Trifonov, Valentina Lisitsa, Idil Biret, Khatia Buniatishvili, Ottorino Respighi, Boris Giltburg"
Jonas Blue,"Martin Jensen, Sigala, Mike Perry, Cheat Codes, Starley, Sam Feldt, Kygo, Felix Jaehn, Lost Frequencies, Seeb, Matoma, Loud Luxury, Jax Jones, OMI, The Chainsmokers, Galantis, Kungs, Axwell /\\ Ingrosso, Gryffin, Robin Schulz"
Keung To,"Mirror, Anson Kong 江𤒹生, Edan 呂爵安, Jer 柳應廷, Coca-Cola Hong Kong, Jeffrey 魏浚笙, 陳卓賢 Ian, Kaho Hung, Error, COLLAR, 吳林峰, Stanley Yau 邱士縉, Jeremy Lee 李駿傑, Jay Fung, Joyce Cheng, Panther Chan, Jace Chan, Marf 邱彥筒, Terence Lam, Mike 曾比特"
Anson Lo 盧瀚霆,
陳卓賢 Ian,"Jeffrey 魏浚笙, Edan 呂爵安, Kaho Hung, Jer 柳應廷, Anson Kong 江𤒹生, Keung To, Jay Fung, Mirror, 吳林峰, Panther Chan, Jace Chan, Terence Lam, Byejack, COLLAR, 陳健安, Joyce Cheng, C AllStar, Endy Chow, Jason Chan, MC 張天賦"
YOASOBI,"Lilas Ikuta, yama, ZUTOMAYO, ヨルシカ, MAISONdes, Ryokuoushoku Shakai, Kenshi Yonezu, milet, King Gnu, OFFICIAL HIGE DANDISM, Aimer, TUYU, Yuuri, Kanaria, Novelbright, Eve, Ado, Mrs. GREEN APPLE, jon-YAKITORY, SEKAI NO OWARI"
MC 張天賦,"Kaho Hung, 陳卓賢 Ian, Jay Fung, Jeffrey 魏浚笙, Edan 呂爵安, Terence Lam, Panther Chan, Jer 柳應廷, Jason Chan, Dear Jane, Keung To, Byejack, C AllStar, 吳林峰, Endy Chow, Jace Chan, Joyce Cheng, Charmaine Fong, Alfred Hui, RubberBand"
JISOO,"ROSÉ, JENNIE, JEON SOMI, LEE CHAE YEON, YENA, TAEYANG, NMIXX, GOT the beat, IZ*ONE, NAYEON, aespa, MIYEON, (G)I-DLE, HyunA, TAEYEON, STAYC, ITZY, IVE, WINNER, YooA"
